{
  "abstract": "全过程人民民主既有完整的制度程序又有完整的参与实践，贯通民主选举、民主协商、民主决策、民主管理、民主监督各环节，是覆盖各领域、各方面、各层次的全链条、全方位、全覆盖的民主。",
  "aliases": [
    "全链条民主",
    "全方位民主",
    "全覆盖民主"
  ],
  "assessment": {
    "learning_objectives": [
      "能够说明全过程人民民主是全链条民主的完整环节",
      "能够理解全过程人民民主覆盖全领域各方面各层次",
      "能够概括全过程人民民主在制度程序与参与实践上的特点"
    ]
  },
  "difficulty": 3,
  "documents": [
    {
      "abstract": "全过程人民民主既有完整的制度程序也有完整的参与实践，把民主选举、民主协商、民主决策、民主管理、民主监督五个环节贯通起来，涵盖经济、政治、文化、社会、生态文明等多方面。它是全链条的民主，五环节环环相扣、内在统一形成完整链条；是全方位的民主，贯通国家政治生活和社会生活各层面，依托从全国到乡镇五级人大及其产生的各类国家机关实现；是全覆盖的民主，贯穿“五位一体”总体布局和“四个全面”战略布局方方面面，使民主原则覆盖各类议题、领域、层级。评判这种民主，既要看有无投票权，更要看有无广泛参与权，看选举承诺能否兑现、制度法律能否执行、权力是否真正受人民监督。",
      "document_id": "doc_244",
      "title": "全过程人民民主是全链条、全方位、全覆盖的民主 · 原文要义"
    },
    {
      "abstract": "从形态特征上，“全链条、全方位、全覆盖”刻画了全过程人民民主的完整性与系统性。全链条指五个民主环节环环相扣、内在统一地贯通，形成从选出代表、充分协商、广纳民意到行使权利和约束权力的完整闭环；全方位指贯通国家政治生活和社会生活各层面各维度，覆盖从中等到乡镇各级人大及其机关；全覆盖指涵盖“五位一体”总体布局和“四个全面”战略布局，民主原则覆盖各类议题、领域、层级。三者共同体现了时间上的连续性、内容上的整体性、运行上的协同性以及参与上的广泛性和持续性。",
      "document_id": "doc_245",
      "title": "概念解析/理论背景"
    },
    {
      "abstract": "这一论述回答了全过程人民民主“全”在哪里，凸显其对西方“选举时民主、选举后无人问津”弊端的针对性。实践上要求在各个环节保障人民参与，让群众意见转化为党和政府的重大决策，让人民对各级国家工作人员履职情况进行监督，保证权力始终为人民谋利益。它需要健全人民当家作主制度保障，并依托协商民主和基层民主把民主落到日常治理中。习近平在中央人大工作会议上提出的“四个更要看”，正是检验这一全链条、全方位、全覆盖民主要求是否落实的评价标尺。",
      "document_id": "doc_246",
      "title": "实践意义/关联"
    },
    {
      "abstract": "2022年7月14日，北京市通州区政协常委汪碧刚在工作室主持第9场你说我听、我说你听协商议事活动，来自潞城镇各村的村民代表围绕电动车充电安全畅所欲言，镇党委副书记当场解答回应。此前工作室8场协商议事活动已解决群众身边具体问题20个。有事好商量、众人的事情由众人商量是人民民主的真谛，该委员工作室正是把这一真谛落到基层的实践，小到充电桩布局大到一村一镇治理，群众都能在家门口参与商量。这种请你来商量的姿态把协商民主制度优势转化为基层治理效能，是全过程人民民主在基层落地生根的生动写照。",
      "document_id": "doc_619",
      "title": "通州汪碧刚委员工作室：'众人的事情由众人商量'"
    },
    {
      "abstract": "上海长宁区虹桥街道是全国人大常委会法工委设立的首批基层立法联系点之一，是观察全过程人民民主的直观窗口。它把立法机关与基层群众直接连通，让普通百姓在家门口参与国家立法，组织居民、企业、专家学者讨论法律草案，征询原汁原味的民意。运行多年来累计有492条居民建议被全国人大常委会采纳，居民结合身边实际提出的部分意见被吸收进入最终法案。联系点还创新“民意直通车”机制，把代表联系、基层治理与立法征询结合，真正实现“立法的大门开在百姓家门口”。这一实践印证全过程人民民主是全链条、全方位、全覆盖的民主，实现了过程民主与成果民主、程序民主与实质民主的统一。",
      "document_id": "doc_1037",
      "title": "上海虹桥街道立法联系点：小窗口里的民主大实践"
    },
    {
      "abstract": "重庆沙坪坝区是全国人大常委会法工委设立的基层立法联系点，是倾听基层声音、践行全过程人民民主的重要平台。通过组建立法信息采集员队伍、设立法律草案意见征询点，把征询触角延伸到社区、企业、高校和农村。针对多部法律草案征求意见时，广泛组织市民座谈，收集来自街道、乡镇的鲜活意见数千条，不少建议被采纳写入正式法律文本。联系点还探索“立法+治理”融合，推动城市更新、物业管理等民生立法更具针对性，居民感叹“自己的话能写进法律”。其累计征集意见数量可观，答复率和办理质量持续提升，把人民当家作主落实到立法各环节，是全过程人民民主“最广泛、最真实、最管用”理念的扎实落地。",
      "document_id": "doc_1038",
      "title": "重庆沙坪坝基层立法联系点：让民意“原汁原味”走进法律"
    }
  ],
  "id": "node_0805",
  "importance": 4,
  "keywords": [
    "全过程人民民主",
    "全链条",
    "全方位",
    "全覆盖",
    "五个环节",
    "制度程序"
  ],
  "name": "全过程人民民主是全链条、全方位、全覆盖的民主",
  "pictures": [],
  "revision": 3,
  "schema_version": "1.0",
  "status": "draft",
  "tags": [
    "第八章",
    "人民民主"
  ],
  "test": [
    {
      "description": "关于全过程人民民主'全链条'包含的环节及其关系，下列说法正确的是（　）：A.全链条仅指选举一个环节。 B.全过程人民民主包括民主选举、民主协商、民主决策、民主管理、民主监督五个环节，它们环环相扣、内在统一，形成完整链条。 C.五个环节相互孤立、互不贯通。 D.只要完成民主决策就实现全过程民主，其他环节多余。",
      "style": "单选题",
      "test_id": "test_1147"
    },
    {
      "description": "判断下列说法是否正确：人民只要在选举时投了票，全过程人民民主就算实现了。",
      "style": "判断题",
      "test_id": "test_1148"
    },
    {
      "description": "关于我国五级人民代表大会及其产生机关如何体现全过程人民民主，下列说法正确的是（　）：A.我国五级人大均非民主选举产生，不代表人民。 B.从全国到乡镇五级人民代表大会均由人民民主选举产生、对人民负责受人民监督，各级人大又产生政府的监察机关、审判机关、检察机关等，使国家治理体现人民意志、保障人民权益。 C.各级人大机关不对人民负责，仅对上级机关负责。 D.国家治理无需体现人民意志。",
      "style": "单选题",
      "test_id": "test_1149"
    },
    {
      "description": "关于'四个更要看'论述（如看有没有投票权更要看有没有广泛参与权）对评判民主的意义，下列说法正确的是（　）：A.评判民主只需看是否举行了形式上的投票。 B.这一论述说明评判民主既要重程序更要重实质、既重形式更要重执行，应以人民广泛参与和监督程度为标准，体现全过程人民民主对西方民主弊端的超越。 C.评判民主只需看法律条文是否完备即可。 D.这一论述说明民主评价应完全照搬西方的标准。",
      "style": "单选题",
      "test_id": "test_1150"
    }
  ],
  "updated_at": "2026-08-15T16:18:49Z"
}