{
  "abstract": "提升国家文化软实力和中华文化影响力，须讲好中国故事、传播好中国声音，不断增强国际话语权。",
  "aliases": [
    "文化软实力",
    "中华文化影响力",
    "国际传播能力"
  ],
  "assessment": {
    "learning_objectives": [
      "理解文化软实力与国家综合国力的关系",
      "理解提升文化软实力关键在于核心价值观的生命力感召力",
      "说明加强国际传播能力建设、塑造可信可爱可敬中国形象的要求"
    ]
  },
  "difficulty": 3,
  "documents": [
    {
      "abstract": "一个大国发展兴盛必然要求文化传播力、文明影响力大幅提升，实现软实力和硬实力相得益彰。文化软实力集中体现一个国家基于文化而具有的凝聚力和生命力及由此产生的吸引力和影响力，虽与硬实力并存，但仍存在信息流进流出的逆差、中国真实形象与西方主观印象的反差、软实力与硬实力的落差。文化软实力从根本上取决于核心价值观的生命力、凝聚力、感召力，因此要使当代中国价值观念走向世界，客观真实讲好中国故事、中国共产党故事和新时代故事，帮助国外民众理解中国共产党为什么能、马克思主义为什么行、中国特色社会主义为什么好。要坚守中华文化立场，提炼展示中华文明的精神标识和文化精髓，塑造可信、可爱、可敬的中国形象。同时加强国际传播能力建设，构建中国话语和中国叙事体系，打造融通中外的新概念新范畴新表述，推进全球化、区域化、分众化表达，全面提升国际传播效能，形成与综合国力和国际地位相匹配的国际话语权。",
      "document_id": "doc_328",
      "title": "不断提升国家文化软实力和中华文化影响力 · 原文要义"
    },
    {
      "abstract": "国家文化软实力集中体现一个国家基于文化而具有的凝聚力和生命力及由此产生的吸引力和影响力，与硬实力相互作用、相得益彰；中华文化影响力指中华文化走向世界、影响他国民众认知的程度与广度。大国发展兴盛必然要求文化传播力和文明影响力大幅提升。提升文化软实力的根本取决于核心价值观的生命力、凝聚力、感召力，即必须要使当代中国价值观念走向世界。当前我国仍存在信息流进流出的逆差、中国真实形象与西方主观印象的反差、软实力与硬实力的落差，需要着力破解。其路径是讲好中国故事、传播好中国声音，提炼展示中华文明的精神标识和文化精髓，展现真实、立体、全面的中国，塑造可信、可爱、可敬的中国形象。",
      "document_id": "doc_329",
      "title": "概念解析/理论背景"
    },
    {
      "abstract": "提升国家文化软实力和中华文化影响力，关系中国在世界文化格局中的定位以及国际地位和影响力，能为实现中华民族伟大复兴营造有利国际舆论环境。实践要求包括：客观真实讲好中国故事、中国共产党故事和新时代故事，帮助国外民众理解中国共产党为什么能、马克思主义为什么行、中国特色社会主义为什么好；全面阐述我国的发展观、文明观、安全观、人权观等治理观；加强国际传播能力建设，加快构建中国话语和中国叙事体系，打造融通中外的新概念、新范畴、新表述；推进全球化表达、区域化表达、分众化表达，采用贴近不同受众的精准传播方式。既要开放自信又要谦逊谦和，更好展现真实立体全面的中国。此知识点是文化强国建设的对外维度，与文化自信、中华优秀传统文化走出去等知识点一内一外、相互支撑。",
      "document_id": "doc_330",
      "title": "实践意义/关联"
    },
    {
      "abstract": "2024年取材自《西游记》的国产单机游戏《黑神话：悟空》全球发行后迅速走红，凭借顶尖画面、创新战斗系统和深厚东方美学，在国内销量火爆并在全球市场口碑与商业双丰收。当年年底，该作斩获有“游戏界奥斯卡”之称的TGA“2024年度最佳动作游戏”，实现国产主机游戏国际奖项的历史性突破。其成功源于对中华优秀传统文化的创造性转化，将陕北说书、佛教造像、古建彩塑等中国元素原汁原味搬上国际舞台。这一案例说明，游戏、影视等新兴载体同样能传播中国故事，是提升国际传播效能、从文化大国迈向文化强国的生动注脚。",
      "document_id": "doc_695",
      "title": "“悟空”出海：国产游戏《黑神话：悟空》斩获TGA最佳动作游戏"
    },
    {
      "abstract": "2023年9月至10月第十九届亚运会在杭州举办，成为体育竞技与中国文化传播深度融合的国际盛会。开幕式舞蹈《水墨入诗画》将富春山居图意蕴与数字火炬融合，数字人火炬手点燃主火炬；赛场内太极拳、龙舟、围棋等传统项目展示中华文化。赛事转播覆盖多国、话题热度空前，成为“城市国际化+文化走出去”的范本。杭州亚运会将竞技体育、城市文化、非遗技艺与现代表达有机结合，注重科技与人文并重，场馆赛后惠民开放。这启示文体赛事是提升文化软实力、开展国际传播的绝佳平台，讲好中国故事需善用国际化语言和全媒体传播。",
      "document_id": "doc_696",
      "title": "以体育之名传文化之韵：杭州亚运会成为国际传播的闪亮舞台"
    },
    {
      "abstract": "首款国产3A单机游戏《黑神话：悟空》2024年8月20日全球发售，取材自《西游记》，运用UE5引擎再现山西、重庆等地古建实景，上线首日位居多国销售榜前列，数日销量突破1000万套，全球累计销量已超3000万套，海外玩家贡献过半，远销欧美日韩引发全球西游热。游戏将大圣形象、京剧唱腔、东方美学推向全球，让众多海外玩家主动了解中国传统神话与古建文化，实现由讲故事到传文化的突破，证明优秀传统文化经现代科技与匠心赋能后具备强劲国际影响力，为文化出海提供了借鉴。",
      "document_id": "doc_1164",
      "title": "《黑神话：悟空》出海：中国文化软实力的新名片"
    }
  ],
  "id": "node_1012",
  "importance": 4,
  "keywords": [
    "文化软实力",
    "中华文化影响力",
    "国际传播",
    "中国故事",
    "国际话语权"
  ],
  "name": "不断提升国家文化软实力和中华文化影响力",
  "pictures": [],
  "revision": 3,
  "schema_version": "1.0",
  "status": "draft",
  "tags": [
    "文化建设",
    "对外传播"
  ],
  "test": [
    {
      "description": "关于国家文化软实力及其提升的根本，下列说法正确的是（　）：A.文化软实力指基于文化而产生的凝聚力、生命力、吸引力、影响力，且与硬实力相互作用。 B.文化软实力只取决于经济总量大小，与价值观念无关。 C.提升文化软实力主要靠扩大领土和军事威慑。 D.文化软实力一旦形成就固定不变，无须持续建设。",
      "style": "单选题",
      "test_id": "test_1274"
    },
    {
      "description": "判断下列说法是否正确：中国综合国力已经跃升，国际传播能力自然就会同步提升，无需专门建设。",
      "style": "判断题",
      "test_id": "test_1275"
    },
    {
      "description": "关于为什么要讲好中国共产党、中国和新时代的故事，下列说法错误的是（　）：A.讲好中国故事能帮助国外民众理解中国共产党为什么能、马克思主义为什么行、中国特色社会主义为什么好。 B.有利于塑造可信、可爱、可敬的中国形象。 C.讲好中国故事对争取国际社会理解和认同、营造良好国际舆论环境没有作用。 D.讲好中国故事有助于传播当代中国价值观念、提升文化软实力。",
      "style": "单选题",
      "test_id": "test_1276"
    },
    {
      "description": "关于国际传播中'全球化表达、区域化表达、分众化表达'，下列说法正确的是（　）：A.用统一的一种表达方式面向所有国外受众即可。 B.要贴近不同区域、国家的实际和不同受众群体，采取适宜的表达方式精准传播。 C.国际传播无须掌握传播规律，可随意编排。 D.越追求表达形式的花哨夸张，越能增强国际传播实效。",
      "style": "单选题",
      "test_id": "test_1277"
    }
  ],
  "updated_at": "2026-08-15T16:18:49Z"
}