{
  "abstract": "事在四方，要在中央。党中央集中统一领导是党的领导的最高原则，是党保持团结统一和强大战斗力、不断取胜的关键，关键是坚决维护习近平同志党中央核心、全党核心地位，并同坚持民主集中制完全一致。",
  "aliases": [
    "党中央权威和集中统一领导",
    "两个维护",
    "两个确立两个维护"
  ],
  "assessment": {
    "learning_objectives": [
      "能够理解维护党中央权威和集中统一领导的重大意义",
      "说明关键在于坚决维护习近平同志的核心地位",
      "理解维护党中央权威与坚持民主集中制的一致性"
    ]
  },
  "difficulty": 3,
  "documents": [
    {
      "abstract": "事在四方，要在中央，党中央集中统一领导是党的领导的最高原则，是党保持团结统一和战斗力、不断取得胜利的关键。这一原则源于马克思主义政党理论，马克思、恩格斯强调必须维护党的权威，列宁要求无产阶级推举善于组织和领导运动的领袖。维护党中央权威必须坚决贯彻党的理论路线方针政策和党中央决策部署，确保政令畅通、令行禁止，其对象是党中央而非其他组织，地方部门权威来自并服从于党中央权威。最关键处是坚决维护习近平同志党中央的核心、全党的核心地位，这是十八大以来的重大政治成果，是历史和人民的共同选择。维护党中央权威同坚持民主集中制完全一致，坚持四个服从，做到既有集中又有民主、既有纪律又有自由，既利科学决策，又可克服分散主义、形成强大合力。",
      "document_id": "doc_91",
      "title": "维护党中央权威和集中统一领导 · 原文要义"
    },
    {
      "abstract": "这一知识点回答了党的领导的最高原则是什么，核心结论是党中央集中统一领导是党的领导的最高原则。从理论看，马恩强调无产阶级政党须维护权威，恩格斯指出没有权威就不可能有任何一致行动，列宁要求无产阶级推举善于组织运动的领袖；从实践看，没有党中央定于一尊的权威就办不成事。因此必须做到两个维护，确立核心地位是十八大以来的重大政治成果。还需澄清维护对象是党中央而非其他组织，以及维护党中央权威同坚持民主集中制完全一致，既有集中又有民主、又有纪律又有自由。",
      "document_id": "doc_92",
      "title": "概念解析/理论背景：维护党中央权威和集中统一领导"
    },
    {
      "abstract": "维护党中央权威和集中统一领导，在实践上要求三点：一是坚决贯彻党的理论路线方针政策和党中央决策部署，确保政令畅通、令行禁止；二是坚决维护习近平同志的核心地位，凝聚全党全国共同意志；三是正确处理与民主集中制的关系，坚持个人服从组织、少数服从多数、下级服从上级、全党服从中央，既不能以强调权威否定民主，也不能借发扬民主破坏集中。这与此前健全坚定维护党中央权威和集中统一领导各项制度的领导制度体系内容相衔接，以统一意志凝聚强大合力。",
      "document_id": "doc_93",
      "title": "实践意义/关联：以统一意志凝聚强大合力"
    },
    {
      "abstract": "秦岭北麓西安境内曾出现大量违规建别墅、破坏生态的问题，个别地方前期整改敷衍、屡清屡查。针对这一严重背离党中央生态文明决策的事件，习近平总书记多次作出重要批示。2018年中央派出由中央纪委国家监委牵头、督导组进驻现场的专项工作组，坚持两个维护最高政治原则全面彻查，最终依法拆除违建别墅1194栋，追责问责上千人次，产生深远的震慑和教育作用。中央纪委指出，秦岭违建整治是一场刀刃向内的政治治理，凸显党中央维护集中统一领导、令行禁止的决心。该事件启示全党必须增强四个意识、坚定四个自信、做到两个维护，确保党中央决策不折不扣贯彻落实，把对党忠诚落实到行动上。",
      "document_id": "doc_772",
      "title": "秦岭违建整治：把“两个维护”落实到行动上"
    },
    {
      "abstract": "2019年2月中共中央印发的《中国共产党重大事项请示报告条例》，是维护党中央权威和集中统一领导的重要党内法规。条例明确下级党组织向上级请示报告重大事项、党员领导干部应向党组织报告个人重大事项，把请示报告上升为必须严格遵守的政治纪律和组织纪律。此前中央先后出台中央委员会工作条例等法规，逐步构建起维护党中央权威的制度体系。实践表明，在脱贫攻坚、疫情防控等任务中执行请示报告制度，保证了党中央及时掌握重大情况、科学决策和全国一盘棋推进。该制度从制度层面巩固了党中央总揽全局、协调各方的地位，为维护党中央权威、确保决策落地见效提供了刚性纪律保障。",
      "document_id": "doc_773",
      "title": "重大事项请示报告：维护党中央权威的制度保障"
    },
    {
      "abstract": "2012年12月中央政治局会议通过关于改进工作作风、密切联系群众的八项规定，以铁的纪律向全党发出狠抓作风、维护中央权威的强烈信号。十多年来全党严格执行八项规定精神，坚持以上率下、层层传导压力。截至2023年底全国纪检监察机关累计查处违反八项规定问题60多万起，处理党员干部80多万人，刹住了一度被认为不可能刹住的歪风邪气，中央纪委网站定期通报典型案例形成震慑。八项规定能落地生根成为改变政治生态的金色名片，关键在于党中央率先垂范、全党严格执行、坚决防止上有政策下有对策。这充分说明维护党中央权威、确保政令畅通是党统一意志和行动的根本要求，是把制度优势转化为治理效能的重要保障。",
      "document_id": "doc_774",
      "title": "中央八项规定：以上率下彰显令行禁止的执行力"
    }
  ],
  "id": "node_0306",
  "importance": 5,
  "keywords": [
    "党中央权威",
    "集中统一领导",
    "最高原则",
    "领导核心",
    "民主集中制",
    "两个维护"
  ],
  "name": "维护党中央权威和集中统一领导",
  "pictures": [],
  "revision": 3,
  "schema_version": "1.0",
  "status": "draft",
  "tags": [
    "党的全面领导",
    "党中央权威",
    "第三章"
  ],
  "test": [
    {
      "description": "关于党中央集中统一领导是党的领导的最高原则，下列说法正确的是（　）：A.因为它只是我们党的一种主观要求，没有客观依据。 B.因为‘事在四方，要在中央’，党中央集中统一领导是党保持团结统一和强大战斗力、不断取胜的关键。 C.因为党中央应当包揽并代替党内外一切具体工作。 D.因为各地方党组织可拥有独立于党中央的权威，无需统一领导。",
      "style": "单选题",
      "test_id": "test_909"
    },
    {
      "description": "判断下列说法是否正确：强调维护党中央权威和集中统一领导，意味着要放弃民主集中制、不要党内民主。",
      "style": "判断题",
      "test_id": "test_910"
    },
    {
      "description": "习近平指出：『我们这么大一个党、这么大一个国家，如果没有党中央定于一尊的权威，党中央决定的事都不去照办，还是各说各的话、各做各的事，那就什么事情也办不成了。』这段话表明的道理是（　）：A.党中央的权威可有可无，各地区可自行其是。 B.必须坚持党中央定于一尊的权威，党中央决策必须不折不扣贯彻执行、令行禁止。 C.维护党中央权威主要是维护中央机构的权威，与领导核心个人无关。 D.只要党中央作好决策，各地方各部门可自行决定是否落实。",
      "style": "单选题",
      "test_id": "test_911"
    },
    {
      "description": "判断下列说法是否正确：维护党中央权威和集中统一领导，可理解为地方的、部门的党组织各自拥有独立于党中央的权威。",
      "style": "判断题",
      "test_id": "test_912"
    }
  ],
  "updated_at": "2026-08-15T16:18:49Z"
}