{
  "abstract": "新时代全面深化改革取得巨大成就但仍需持续推进，须坚定信心决心、坚持问题导向，聚焦重大问题攻坚克难，把改革不断引向深入。",
  "aliases": [
    "引向深入",
    "改革攻坚克难",
    "持续推进改革"
  ],
  "assessment": {
    "learning_objectives": [
      "能够理解新时代全面深化改革仍需持续推进的原因",
      "能够说明聚焦重大问题攻坚克难开展改革的要求",
      "能够把握新征程上深化改革开放的部署"
    ]
  },
  "difficulty": 3,
  "documents": [
    {
      "abstract": "新时代全面深化改革取得巨大成就但仍需持续推进，改革道路上仍有很多硬骨头要啃、难关要攻克。在全面建设社会主义现代化国家新征程上，根本动力仍然是改革开放，延续关键一招。党的二十大围绕中心任务对全面深化改革作出新部署，要推出一批战略性、创造性、引领性改革举措，加强系统集成、协同高效，在重要领域和关键环节取得新突破。要聚焦重大问题，统筹全局、把握重点，深化社会主义市场经济、人民当家作主制度、文化、社会、生态文明等体制改革及党的建设制度改革，形成有利于贯彻新发展理念、构建新发展格局、推动高质量发展的体制机制；比认识更重要的是决心，比方法更关键的是担当，要立足新发展阶段推动改革迈出新步伐。",
      "document_id": "doc_151",
      "title": "坚定不移把全面深化改革引向深入 · 原文要义"
    },
    {
      "abstract": "\"把全面深化改革引向深入\"强调改革不因取得阶段性成就而止步，而要顺应时代和实践变化持续推进。改革开放啃下不少硬骨头但还有许多硬骨头要啃、攻克了许多难关但还有许多难关要攻克。党的二十大围绕全面建成社会主义现代化强国、以中国式现代化全面推进中华民族伟大复兴的中心任务对全面深化改革作出新部署。内涵上，要求推出一批战略性、创造性、引领性改革举措，加强系统集成、协同高效，在重要领域和关键环节取得新突破。\"引向深入\"有三层指向：横向领域拓展，在经济、政治、文化、社会、生态、党建各领域形成有利于落实新发展理念的体制机制；纵向攻坚克难，聚焦重大问题统筹全局把握重点；组织上坚持和加强党的领导、把准方向，体现改革作为根本动力的持续性与后劲。",
      "document_id": "doc_152",
      "title": "概念解析/理论背景：把全面深化改革'引向深入'的指向"
    },
    {
      "abstract": "实践上要坚持和加强党的领导，把准改革方向、明确目标任务，以科学谋划和创新魄力把工作抓实，聚焦全面建设社会主义现代化国家的重大问题，深化各领域体制机制改革，健全党的全面领导与全面从严治党制度体系。其中蕴含的核心判断是比认识更重要的是决心、比方法更关键的是担当，深化改革从认识到行动的关键在于政治担当与落实。这一节点衔接改革开放永无止境与后续扩大对外开放，落实改革总目标在各领域的制度完善任务。其要旨在于深化改革不是另起炉灶，而是在既有改革成就基础上做深做透、啃最硬的骨头。",
      "document_id": "doc_153",
      "title": "实践意义/关联：以决心担当抓改革攻坚"
    },
    {
      "abstract": "“放管服”改革是激发市场活力、深化治理的关键举措。新时代以来我国持续推进“一网通办”“一网统管”，企业开办时间压缩到1个工作日以内，“最多跑一次”“不见面审批”在全国推开。世界银行《全球营商环境报告》中中国排名从2013年第96位跃升至2020年第31位，市场主体破亿、民营经济蓬勃发展。2020年《优化营商环境条例》施行，营商环境建设进入制度化、法治化轨道，以政府权力“减法”换取市场活力“乘法”。",
      "document_id": "doc_677",
      "title": "“放管服”改革纵深推进，营商环境国际竞争力显著提升"
    },
    {
      "abstract": "国企改革三年行动（2020—2022年）围绕完善中国特色现代企业制度全面收官。改革推行经理层任期制和契约化管理，实现管理人员能上能下、收入能增能减；混合所有制改革稳妥推进，国有经济布局优化与战略性重组不断加快，一批世界一流企业加速形成。中国宝武、国家电投等央企通过重组与改革做优做强，党的领导全面加强，企业核心竞争力大幅提升，为做强做优做大国有经济奠定坚实基础。",
      "document_id": "doc_678",
      "title": "国企改革三年行动：完善中国特色现代企业制度，国企活力效率增强"
    },
    {
      "abstract": "《中华人民共和国民营经济促进法》2025年出台施行，是落实党的二十届三中全会关于构建高水平社会主义市场经济体制部署的鲜明例证。该法将“两个毫不动摇”和促进民营经济发展壮大的政策以法律形式固定，从市场准入、要素获取、权益保护等方面作出制度安排，建立公平竞争审查制度，为民营企业营造稳定公平透明的法治环境。全国人大常委会加快立法并广泛征求意见，以法律稳定预期、激发活力。截至2025年民营企业数量已突破5500万户。这表明新征程上的改革通过具体立法与制度创新扎实落地，推动社会主义市场经济体制日益成熟定型，为高质量发展提供坚实制度保障。",
      "document_id": "doc_1146",
      "title": "《民营经济促进法》出台落地：落实二十届三中全会改革部署"
    }
  ],
  "id": "node_0508",
  "importance": 4,
  "keywords": [
    "深化改革",
    "引向深入",
    "攻坚克难",
    "系统集成",
    "问题导向"
  ],
  "name": "坚定不移把全面深化改革引向深入",
  "pictures": [],
  "revision": 3,
  "schema_version": "1.0",
  "status": "draft",
  "tags": [
    "全面深化改革",
    "持续深化",
    "实践推进"
  ],
  "test": [
    {
      "description": "关于在全面建设社会主义现代化国家新征程上把全面深化改革引向深入、抓住的主要方面，下列说法正确的是（　）：A.只需保持原有改革举措不变，不必再出台新的举措。 B.推出一批战略性、创造性、引领性改革举措，加强系统集成、协同高效，并在关键环节取得新突破。 C.深化改革只需由经济领域单兵突进即可，不必统筹政治、文化等其他领域。 D.只要完成阶段性任务即可宣告改革结束、无需坚持和加强党的领导。",
      "style": "单选题",
      "test_id": "test_996"
    },
    {
      "description": "判断下列说法是否正确：改革推进到今天，认识已经足够，关键在于总结新认识。",
      "style": "判断题",
      "test_id": "test_997"
    },
    {
      "description": "关于'加强改革系统集成、协同高效，在重要领域和关键环节取得新突破'，下列说法正确的是（　）：A.系统集成指各项改革政策各自为战、互不相关。 B.协同高效指各领域改革单兵突进、不形成整体效能。 C.系统集成要求各项改革政策相互配合、前后呼应，协同高效要求各领域改革联动形成整体效能。 D.只要在某一关键环节取得突破，就无需其他环节配合。",
      "style": "单选题",
      "test_id": "test_998"
    },
    {
      "description": "教材指出'已啃下不少硬骨头但还有许多硬骨头要啃'。对把握改革形势和处理当前任务，下列说法正确的是（　）：A.已取得巨大成就，说明改革可以就此止步、无需继续推进。 B.这一判断表明改革已无困难，按部就班即可。 C.既要肯定成就，又要正视困难、看到不进则退，改革仍处于攻坚阶段，应激励人们勇于啃硬骨头、敢于涉险滩。 D.硬骨头无关紧要，只需处理容易推进的部分即可。",
      "style": "单选题",
      "test_id": "test_999"
    },
    {
      "description": "关于新征程上深化经济、政治、文化、生态等各领域体制改革的目标指向，下列说法正确的是（　）：A.经济体制改革服务于GDP总量最大化，与新发展理念无关。 B.文化体制改革服务于意识形态凝聚力和文化强国建设，生态体制改革服务于绿色转型和美丽中国建设。 C.各领域改革彼此独立，改革目标互不相关。 D.政治体制改革主要是为了扩大对外宣传，与全过程人民民主无关。",
      "style": "单选题",
      "test_id": "test_1000"
    }
  ],
  "updated_at": "2026-08-15T16:18:49Z"
}