{
  "abstract": "制度问题带有根本性、全局性、稳定性和长期性，要把制度建设贯穿党的各项建设之中，坚持制度治党、依规治党，靠制度管权管事管人，让制度优势转化为治理效能。",
  "aliases": [
    "制度治党依规治党",
    "党内法规制度建设",
    "制度建设贯穿党的建设"
  ],
  "assessment": {
    "learning_objectives": [
      "能够理解制度具有根本性全局性稳定性长期性",
      "能够说明把制度建设贯穿党的各项建设之中的要求",
      "能够理解制度治党依规治党重在抓落实"
    ]
  },
  "difficulty": 3,
  "documents": [
    {
      "abstract": "习近平强调从严治党既要靠思想教育，也要靠制度保障，靠制度是长远之策、根本之策。要把制度建设贯穿到党的各项建设之中，坚持制度治党、依规治党，靠制度管权、管事、管人。截至2022年6月，全党现行有效党内法规3718部，实现党的领导和党的建设各方面制度全覆盖。要以党章为根本、民主集中制为核心，与时俱进制定修订党内法规，完善制度体系。党内监督是永葆党的肌体健康的生命之源，是最根本、第一位的监督。制定制度重要，落实更重要，防止制度沦为「稻草人」，坚持有规必依、制度面前人人平等，形成尊崇、遵守、捍卫制度的氛围。",
      "document_id": "doc_523",
      "title": "把制度建设贯穿到党的各项建设之中 · 原文要义"
    },
    {
      "abstract": "制度建设贯穿到党的各项建设之中，依据的是法规制度带有根本性、全局性、稳定性、长期性的特征。习近平强调从严治党要靠制度保障，靠制度是长远之策、根本之策。制度治党、依规治党的实质是「靠制度管权、管事、管人」。党内法规是全面从严治党的重要制度支撑，截至2022年6月全党现行有效党内法规3718部，实现各方面制度全覆盖。要以党章为根本、民主集中制为核心，与时俱进制定修订党内法规；党内监督是最根本、第一位的监督，且制定重要、落实更重要，防止制度成「稻草人」，做到有规必依、执规必严、制度面前人人平等。",
      "document_id": "doc_524",
      "title": "概念解析/理论背景"
    },
    {
      "abstract": "制度建设的实践要求是完善内容科学、程序严密、配套完备、运行有效的党内法规制度体系，及时将行之有效的措施制度化、法规化；推动完善党和国家监督体系，以党内监督为主导，促进各类监督贯通协调，让权力在阳光下运行；坚持有规必依，落实不力就是失职，坚决纠正有令不行、有禁不止，培育尊崇、遵守、捍卫制度的良好氛围。它呼应全面从严治党体系「制度上全贯通」的要求，与「把权力关进制度的笼子里」紧密相连；与「三不腐」中的「不能腐」互为表里，制度刚性约束是防止权力出轨的关键，体现「思想建党与制度治党相统一」的根本经验。",
      "document_id": "doc_525",
      "title": "实践意义/关联"
    },
    {
      "abstract": "2023年12月中共中央印发新修订的《中国共产党纪律处分条例》，这是继2015年、2018年后的再次修订。全条例共3编11章158条，将党的纪律完整界定为政治、组织、廉洁、群众、工作、生活六项纪律，把“两个维护”明确为最根本的政治纪律要求，细化违反组织纪律情形，充实形式主义、官僚主义违纪情形，完善涉黄赌毒、干预插手市场经营等处分规定。条例坚持问题导向、与时俱进，把行之有效的监督执纪经验固化为制度成果，为管党治党、党员自我约束提供根本遵循，标志制度治党、依规治党迈上新台阶。",
      "document_id": "doc_982",
      "title": "新修订《中国共产党纪律处分条例》：制度治党的最新成果"
    },
    {
      "abstract": "2018年3月十三届全国人大一次会议通过《中华人民共和国监察法》，国家监察委员会正式挂牌，标志国家监察体制改革取得标志性成果。改革从北京、山西、浙江试点起步后在全国推开，至2018年底县级以上各级监委全部组建完成，实现对所有行使公权力公职人员监察全覆盖。监委同纪检监察机关合署办公，整合行政监察和检察机关反贪反渎力量，建立集中统一、权威高效的中国特色国家监察体制。改革实质是把党对反腐败工作的统一领导具体化、制度化，解决监督力量分散、覆盖不全问题，形成全面覆盖、常态长效的监督合力。",
      "document_id": "doc_983",
      "title": "国家监察体制改革：构建统一高效的监督体系"
    },
    {
      "abstract": "依规治党、制度治党是全面从严治党的治本之策。2023年中央印发《中央党内法规制定工作规划纲要（2023-2027年）》作出系统部署，此前已先后印发两期五年规划纲要。截至2023年全党现行有效党内法规近4000部，形成以党章为根本、以准则条例为主干、覆盖党的建设各领域的比较完善的党内法规制度体系。这些法规把党要管党、从严治党要求细化为具体可操作的规则，使党组织和党员行为有据可依、权力运行有规可循，为党和国家监督体系提供刚性支撑，实现管党治党规范化、制度化、程序化。",
      "document_id": "doc_984",
      "title": "党内法规体系：制度治党的四梁八柱"
    }
  ],
  "id": "node_1708",
  "importance": 4,
  "keywords": [
    "根本性全局性",
    "依规治党",
    "党内法规体系",
    "制度执行力",
    "党内监督"
  ],
  "name": "把制度建设贯穿到党的各项建设之中",
  "pictures": [],
  "revision": 3,
  "schema_version": "1.0",
  "status": "draft",
  "tags": [
    "制度建设",
    "依规治党"
  ],
  "test": [
    {
      "description": "关于「靠制度是管党治党长远之策、根本之策」的理由，下列说法正确的是（　）：A.法规制度带有根本性、全局性、稳定性、长期性，能管长期、管根本、不因人而废；B.制度只是权宜之计，靠人治更可靠；C.只要把措施写进文件即成制度，无须完善运行；D.制度建设与依规治党无关，可另行其道。",
      "style": "单选题",
      "test_id": "test_1588"
    },
    {
      "description": "判断下列说法是否正确：制定制度是全面从严治党的关键，制度制定出来以后是否切实执行则无关紧要。",
      "style": "判断题",
      "test_id": "test_1589"
    },
    {
      "description": "关于党内监督在党和国家监督体系中的地位及完善监督体系，下列说法正确的是（　）：A.党内监督与其他监督相互对立，不能贯通协调；B.党内监督是最根本、第一位的监督，是监督体系的动力之源，要以党内监督为主导，促进各类监督贯通协调、让权力在阳光下运行；C.完善监督体系只须按党内要求即可，与国家监督无关；D.监督只是为了事后问责，无须事前事中监督。",
      "style": "单选题",
      "test_id": "test_1590"
    },
    {
      "description": "关于新时代完善党内法规制度体系应坚持的原则和把握的核心，下列说法正确的是（　）：A.以党章为根本、以民主集中制为核心，以党的建设新形势新任务为牵引；B.以某一方面制度为核心即可，无须以党章为根本；C.党内法规体系不必讲求内容科学、程序严密；D.只须沿袭既有制度，无须与时俱进制定修订。",
      "style": "单选题",
      "test_id": "test_1591"
    },
    {
      "description": "截止2022年6月，全党现行有效党内法规共3718部。关于这一数据体现的党内法规制度建设成效及意义，下列说法正确的是（　）：A.党内法规建设力度空前、成果丰硕，实现党的领导和党的建设各方面制度全覆盖；B.党内法规数量虽多但作用有限，无法推动制度治党；C.党内法规建设与治理效能、政治保障无关；D.党内法规数量越多越好，无须讲求体系完备、内容科学。",
      "style": "单选题",
      "test_id": "test_1592"
    }
  ],
  "updated_at": "2026-08-15T16:18:49Z"
}