{
  "abstract": "千秋基业、人才为先，人才是实现民族振兴、赢得国际竞争主动的战略资源，须实施人才强国战略、加快建设人才强国。",
  "aliases": [
    "人才强国战略",
    "人才战略资源"
  ],
  "assessment": {
    "learning_objectives": [
      "能够说明人才是实现民族振兴、赢得国际竞争主动的战略资源",
      "能够理解实施人才强国战略是国家和民族长远发展大计",
      "能够把握建设规模宏大、结构合理、素质优良人才队伍的要求"
    ]
  },
  "difficulty": 3,
  "documents": [
    {
      "abstract": "千秋基业，人才为先，国家发展靠人才、民族振兴靠人才，实施人才强国战略、建设规模宏大、结构合理、素质优良的人才队伍，是我国社会主义现代化建设的必然选择。人才是人力资源中能力和素质较高的劳动者，在国家发展中具有重要战略地位，在信息化、知识经济和创新驱动时代已成为推动社会发展最活跃、最积极的因素，谁拥有一流人才谁就拥有发展优势和主导权。加快人才队伍建设是推动国家发展、实现民族复兴的必然要求，到本世纪中叶建成社会主义现代化强国，实现经济科技综合国力大幅跃升、高水平科技自立自强等目标，都需要建设规模宏大、结构合理、素质优良的人才队伍作坚实基础和重要支撑。",
      "document_id": "doc_223",
      "title": "培养人才是国家和民族长远发展大计 · 原文要义"
    },
    {
      "abstract": "培养人才是国家和民族长远发展大计，千秋基业、人才为先，国家发展靠人才、民族振兴靠人才。人才是人力资源中能力和素质较高的劳动者，具有重要战略地位，古往今来都是富国之本、兴邦大计；在信息化、知识经济和创新驱动时代已成为推动社会发展最活跃最积极的因素。教材从两方面展开：一是人才竞争决定国家命运，谁拥有一流人才谁就拥有发展优势和主导权，哪个国家拥有人才优势哪个国家最终就拥有实力优势，当今各国竞相把增强人才优势上升为国家战略；二是加快人才队伍建设是推动国家发展、实现民族复兴的必然要求，建成社会主义现代化强国须建设规模宏大、结构合理、素质优良的人才队伍，必须增强忧患意识、加快建立人才资源竞争优势。",
      "document_id": "doc_224",
      "title": "概念解析/理论背景：人才为国之本"
    },
    {
      "abstract": "确立人才建设的长远大计地位，要求把人才强国作为战略国策、加快建立人才资源竞争优势。实践上全面贯彻党的人才工作部署，坚持全方位培养、引进、使用人才，对接服务发展、人才优先、以用为本、创新机制、高端引领、整体开发的方针，把人才工作贯穿到全面建设社会主义现代化国家全过程。它构成第四节建设人才强国的总起，与人才引领驱动方针呼应，印证人才是第一资源的论断，同教育强国、科技强国建设联动——教育育才、科技用才，共同服务民族复兴大局。理解本节点要把握人才的时代价值，从人力资源走向人才资源竞争优势，人才投入是回报最高、最关乎长远的发展投入。",
      "document_id": "doc_225",
      "title": "实践意义/关联：人才资源是第一资源"
    },
    {
      "abstract": "颜宁是我国结构生物学杰出青年科学家，早年深耕蛋白质三维结构与功能研究，取得多项国际领先成果。怀着服务祖国的信念，2022年底她辞去海外终身教职回国，牵头筹建深圳医学科学院并出任创始院长，2023年当选中国科学院院士。在深圳她聚焦临床与基础研究交叉融合，推动医学科技体制创新，吸引大批海内外青年才俊加盟。其“双向奔赴”正是我国实施人才强国战略的缩影：通过优化政策、改善科研生态、提供广阔舞台，让优秀人才引得进、留得住、用得好，印证了“聚天下英才而用之”的重要意义。",
      "document_id": "doc_661",
      "title": "颜宁：归国科学家创办深圳医学科学院"
    },
    {
      "abstract": "世界知名结构生物学家施一公在海外功成名就后全职回国，先后在清华大学任教，并在国家支持下创办西湖大学，探索“高起点、研究型、小而精”的新型研究型大学之路。西湖大学坚持教授治校，聚焦基础研究与原始创新，广纳全球英才，鼓励甘坐“冷板凳”、勇闯“无人区”。施一公强调重大科技要更多实现“从0到1”突破，关键在于人才自主培养与创新环境。他因卓越研究当选中国科学院院士。其经历体现人才是第一资源、创新是第一动力，国家通过“千人计划”等制度引才聚才，为归来学者搭建平台，为中国科技自立自强注入人才动能。",
      "document_id": "doc_662",
      "title": "施一公：用“从0到1”回应时代之问"
    },
    {
      "abstract": "哈尔滨工程大学通过“政策+平台”双轮驱动集聚人才，是人才强国战略落地的典型。2024年举办的“兴海论坛”以海洋强国战略为牵引，面向全球发布博士后、青年教师及海外优青岗位，吸引近3000名海内外青年学者报名。学校以事业引才、平台聚才、待遇留才，提供有竞争力的科研启动经费、住房安居保障和晋升通道，依托水下机器人、船舶海洋等国家级平台让青年人才一入职即参与重大科研攻关。通过持续引才，该校青年骨干队伍不断壮大，为海洋装备、智能船舶等关键领域集聚高水平人才梯队。其实践表明人才强国战略需要政策与平台双轮驱动，把人才集聚到国家战略需要的领域，以人才强支撑科技强、产业强。",
      "document_id": "doc_1155",
      "title": "哈尔滨工程大学'兴海论坛'：政策与平台双轮驱动集聚青年人才"
    }
  ],
  "id": "node_0710",
  "importance": 5,
  "keywords": [
    "人才强国",
    "战略资源",
    "民族振兴",
    "人才队伍建设",
    "长远发展"
  ],
  "name": "培养人才是国家和民族长远发展大计",
  "pictures": [],
  "revision": 3,
  "schema_version": "1.0",
  "status": "draft",
  "tags": [
    "人才强国",
    "人才培养",
    "国家长远发展"
  ],
  "test": [
    {
      "description": "关于'人才是国家和民族长远发展大计'，下列说法正确的是（　）：A.人才只是能力和素质较高的劳动者，其重要性尚不具备战略地位。 B.人才是富国之本、兴邦大计，是推动社会进步最活跃最积极的因素，拥有人才就拥有发展的优势和主导权，故人才是国家和民族长远发展大计。 C.只要有资金和资源，无需专门培养人才。 D.人才的重要性主要体现在日常生活便利，与民族复兴无关。",
      "style": "单选题",
      "test_id": "test_1115"
    },
    {
      "description": "判断下列说法是否正确：人才只是国家发展的重要条件之一，与自然资源、资金等相比并没有特殊地位。",
      "style": "判断题",
      "test_id": "test_1116"
    },
    {
      "description": "关于各国竞相把人才优势上升为国家战略的原因，下列说法正确的是（　）：A.人才竞争决定国家发展的优势和主导权，人才是构建国家核心竞争力的关键，必须增强忧患意识、加快建立人才资源竞争优势。 B.人才战略只是为了应对短期人才短缺。 C.人才的数量多寡无关紧要，唯有加大资本投入才能赢得竞争。 D.把人才上升为国家战略只是对外宣传需要。",
      "style": "单选题",
      "test_id": "test_1117"
    },
    {
      "description": "关于到本世纪中叶建成社会主义现代化强国对人才队伍建设提出的更高要求，下列说法正确的是（　）：A.建成现代化强国只需增加物质投入，与人才队伍无关。 B.必须建设规模宏大、结构合理、素质优良的人才队伍，为建成现代化经济体系和高水平科技自立自强提供坚实人才支撑。 C.只需培养个别顶尖科学家即可，无需整体人才队伍建设。 D.人才队伍建设以追求数量为主，结构是否合理无关紧要。",
      "style": "单选题",
      "test_id": "test_1118"
    },
    {
      "description": "关于'千秋基业，人才为先'所体现的、把人才队伍建设放到国家战略高度的历史逻辑，下列说法正确的是（　）：A.人才是富国之本、兴邦大计，历来如此，新时代更要抢占人才竞争制高点，加快人才队伍建设是民族复兴的必然要求。 B.人才只在古代重要，现代国家无需强调人才优先。 C.人才队伍建设只需服务眼前利益，无需着眼长远。 D.'人才为先'意味着其他资源都不重要。",
      "style": "单选题",
      "test_id": "test_1119"
    }
  ],
  "updated_at": "2026-08-15T16:18:49Z"
}