{
  "abstract": "中国特色社会主义政治制度由根本、基本和重要政治制度构成，是党领导人民在长期实践中形成的。实践证明这一制度行得通、有生命力、有效率，是从中国社会土壤中生长起来的、能够保证人民当家作主的先进制度。",
  "aliases": [
    "中国特色社会主义政治制度",
    "根本政治制度",
    "四梁八柱"
  ],
  "assessment": {
    "learning_objectives": [
      "能够说明中国特色社会主义政治制度的构成体系",
      "能够理解这一制度行得通、有生命力、有效率的根本原因",
      "能够运用评判政治制度是否民主有效的标准进行分析"
    ]
  },
  "difficulty": 3,
  "documents": [
    {
      "abstract": "中国特色社会主义政治制度是中国共产党带领人民在长期实践中形成的人民当家作主制度安排，由根本政治制度、基本政治制度、重要政治制度构成四梁八柱。人民代表大会制度是坚持党的领导、人民当家作主、依法治国有机统一的根本政治制度安排。这一制度从中国社会土壤中生长起来，具有鲜明中国特色。在实践中显示出巨大优势：保证人民广泛参加国家治理、调节国家政治关系、凝聚力量攻坚、维护国家主权安全。评价其民主有效，看领导层能否依法更替、人民能否依法管理国事、权力能否受制约监督等。十八大以来全过程人民民主全面发展，政治制度优越性得到充分彰显。",
      "document_id": "doc_235",
      "title": "中国特色社会主义政治制度行得通、有生命力、有效率 · 原文要义"
    },
    {
      "abstract": "中国特色社会主义政治制度行得通、有生命力、有效率，其理论支点在于马克思主义民主首先而且主要是一种国家制度的论断。这一制度由根本政治制度、基本政治制度以及重要政治制度共同构成四梁八柱。之所以行得通，在于它是从中国的社会土壤中生长起来的，经过长期历史传承、内生性演化而来，坚持从国情和实际出发。有生命力，体现在实践中显示出巨大优势：保证人民广泛参加国家治理、集中力量办大事、调节国家政治关系、维护国家主权安全。有效率，体现在评价标准上——国家领导层能否依法有序更替、人民能否依法管理国家事务、权力能否受制约监督等逐一得到回应。",
      "document_id": "doc_236",
      "title": "概念解析/理论背景"
    },
    {
      "abstract": "这一知识点把制度自信落到政治制度这一具体层面，是坚定中国特色社会主义制度自信的基石。其现实意义在于：政治制度不是抽象摆设，而是关乎国家治理效能、关乎人民当家作主能否兑现。十八大以来，通过全面深化党和国家机构改革实现机构职能系统性重构，推进协商民主广泛多层制度化发展、铸牢中华民族共同体意识、贯彻党的宗教工作基本方针，社会主义民主政治制度化、规范化、程序化全面推进，都是制度优势的生动注脚。它呼应人民民主是社会主义的生命——生命须由制度承载，又以四个能否标准为走正确道路提供判断依据。评价民主制度要用实践标准，不能搬用单一标尺衡量不同政治文明。",
      "document_id": "doc_237",
      "title": "实践意义/关联"
    },
    {
      "abstract": "上海长宁区虹桥街道古北市民中心设有全国人大常委会法工委基层立法联系点，是首批联系点之一，被誉为老百姓在家门口表达社情民意的直通车，居民常就民法典草案、未成年人保护法修订等国家大法发表意见。2019年11月2日总书记考察虹桥街道，首次提出人民民主是一种全过程的民主的重要论断，揭示人民不仅有选举权更能全过程参与国家治理，立法、决策、监督各环节都应有人民的声音。从基层立法联系点实践到全过程人民民主理念，党把主张与人民意愿高度统一，为社会主义民主政治建设指明方向。",
      "document_id": "doc_618",
      "title": "虹桥街道立法联系点：全过程人民民主的生动注脚"
    },
    {
      "abstract": "坚持全国一盘棋、集中力量办大事是中国特色社会主义制度的显著优势，港珠澳大桥的建成通车正是集中写照。这座连接香港、珠海、澳门的跨海大桥全长约55公里，是世界最长跨海大桥，主体包括三地共建的世界最长海底沉管隧道，设计使用寿命120年。工程2009年动工、2018年10月通车，面对伶仃洋复杂海况，建设者攻克超深超大超高难题创下多项世界纪录，靠的是党和国家统一领导、总体谋划。大桥建成后粤港澳大湾区形成一小时生活圈带动一体化发展。大桥彰显了中国工程奇迹背后的制度力量，正是集中力量办大事的组织动员能力，才聚全国之智、成世界之业。",
      "document_id": "doc_1033",
      "title": "港珠澳大桥：集中力量办大事的典范工程"
    },
    {
      "abstract": "如期打赢脱贫攻坚战，是中国共产党领导的政治优势和集中力量办大事的制度优势的直接体现。党中央把脱贫攻坚摆在治国理政突出位置，建立中央统筹、省负总责、市县抓落实机制，累计选派驻村工作队25.5万个、驻村干部300多万名，投入扶贫资金超1.6万亿元。到2020年底，现行标准下9899万农村贫困人口全部脱贫，832个国家贫困县全部摘帽，区域性整体贫困得到解决，历史性告别绝对贫困。从一村一策、东西部扶贫协作到产业帮扶、易地扶贫搬迁，靠的是社会主义制度集中力量、统一调度的优势。这一中国奇迹既是民生改善的里程碑，也充分彰显了全国一盘棋的制度优势，为全球减贫事业贡献了中国方案。",
      "document_id": "doc_1034",
      "title": "决战决胜脱贫攻坚：制度优势创造人间奇迹"
    }
  ],
  "id": "node_0802",
  "importance": 5,
  "keywords": [
    "政治制度",
    "根本政治制度",
    "基本政治制度",
    "人民当家作主",
    "制度优势",
    "内生性演化"
  ],
  "name": "中国特色社会主义政治制度行得通、有生命力、有效率",
  "pictures": [],
  "revision": 3,
  "schema_version": "1.0",
  "status": "draft",
  "tags": [
    "第八章",
    "政治制度"
  ],
  "test": [
    {
      "description": "关于中国特色社会主义政治制度的'四梁八柱'，下列说法正确的是（　）：A.根本政治制度是人民代表大会制度，基本政治制度包括中国共产党领导的多党合作和政治协商制度、民族区域自治制度、基层群众自治制度。 B.人民代表大会制度只是基本政治制度，多党合作和政治协商制度才是根本政治制度。 C.政治制度体系中不需要重要政治制度作为补充。 D.'四梁八柱'仅指单一的某项制度。",
      "style": "单选题",
      "test_id": "test_1134"
    },
    {
      "description": "判断下列说法是否正确：一种政治制度好不好，主要看它是否与西方发达国家一致；凡是西方没有的制度我们就应该去掉。",
      "style": "判断题",
      "test_id": "test_1135"
    },
    {
      "description": "关于我国政治制度'集中力量办大事'的优势体现，下列说法正确的是（　）：A.坚持党的领导、统筹各方，能够有效促进社会生产力发展、推动现代化建设。 B.'集中力量办大事'只需依靠行政命令强制推行，无需发挥制度优势。 C.这一优势仅体现在经济建设领域，与社会治理无涉。 D.只有削弱党的领导才能实现'集中力量办大事'。",
      "style": "单选题",
      "test_id": "test_1136"
    },
    {
      "description": "关于'一个国家政治制度是不是民主、有效'的评价标准，下列说法正确的是（　）：A.只要形式上举行选举投票，政治制度就算民主有效，无需考察实际效果。 B.评价标准主要包括能否依法有序更替权力、能否保证人民依法管理国家事务、能否畅通表达利益诉求、权力运用是否受到制约监督等。 C.评价政治制度的优劣只能看它是否和西方发达国家一致。 D.政治制度好不好只看其法律条文规定得是否详尽。",
      "style": "单选题",
      "test_id": "test_1137"
    }
  ],
  "updated_at": "2026-08-15T16:18:49Z"
}