{
  "abstract": "保持战略定力，指面对复杂形势和困难时保持发展方向、道路、原则的稳定性与坚定性，不为一时一事所扰、不为局部问题所惑。它在坚持原则基础上实现战略机动，把战略定力与积极作为、增强忧患意识辩证统一起来，是统筹发展和安全、推进改革攻坚的重要方法论。",
  "aliases": [
    "保持战略定力"
  ],
  "assessment": {
    "learning_objectives": [
      "掌握「保持战略定力」的基本内容"
    ]
  },
  "difficulty": 3,
  "documents": [
    {
      "abstract": "「保持战略定力」是《习近平新时代中国特色社会主义思想学习纲要》方法论专题中的知识点，该内容阐明保持战略定力的核心要义与要求，属于党员干部掌握科学思想方法和工作方法的重要内容。",
      "document_id": "doc_553",
      "title": "保持战略定力·原文要义"
    },
    {
      "abstract": "「保持战略定力」是习近平总书记提出的重要治国理政方法论，核心理念源于2013年前后关于做好经济工作、应对复杂局面的论述。战略定力指面对复杂形势和困难时，保持发展方向、道路、原则的稳定性与坚定性，不为一时一事所扰、不为局部问题所惑。其理论依据是马克思主义量变质变规律与主要矛盾原理，实践中强调稳中求进总基调，正确处理变与不变的辩证关系。它区别于因循守旧与消极无为，而在坚持原则基础上实现战略机动，并增强忧患意识、保持战略主动辩证统一。",
      "document_id": "doc_554",
      "title": "保持战略定力：概念内涵、理论逻辑与历史背景"
    },
    {
      "abstract": "在百年未有之大变局下，保持战略定力意义重大，有利于抵御外部风险、排除干扰，保证重大战略部署一以贯之落实，克服急功近利等短视行为，保障高质量发展。实践要求包括：坚定政治方向，同党中央保持高度一致；在重大原则问题上旗帜鲜明；把战略定力与战略安排结合；既保持定力又积极作为，把定力转化为改革攻坚的实际行动。它与统筹发展和安全、稳中求进总基调、增强忧患意识等方针政策紧密关联，是习近平新时代中国特色社会主义思想方法论专题和党思想方法工作方法的有机组成部分。",
      "document_id": "doc_555",
      "title": "保持战略定力：现实意义、实践要求与关联"
    },
    {
      "abstract": "在中美贸易摩擦中，中国运用稀土等战略资源实施合法合规的出口管制，体现保持战略定力、维护国家安全的立场。2023年8月起商务部公布镓、锗及稀土相关物项的出口管制措施和清单。中国稀土产量约占全球三分之二，稀土永磁材料在全球供应链中举足轻重。中方既秉持扩大开放、维护全球产业链稳定的姿态，又依法规制危害国家安全的行为，做到有理、有利、有节；面对美方关税施压坚定回应却不对抗，秉持相互尊重、公平正义、合作共赢原则，守住战略利益，展现负责任大国的定力，被视为应对“脱钩断链”、维护多边贸易体制的重要实践。",
      "document_id": "doc_1100",
      "title": "稀土之“牌”：以战略定力应对贸易摩擦"
    },
    {
      "abstract": "港珠澳大桥等世纪工程是保持战略定力、持之以恒推进国家战略的缩影。大桥全长约55公里，是世界上最长的跨海大桥，2009年动工、2018年建成通车，近十年攻克深水沉管隧道、人工岛等世界级难题，凝聚两岸三地长期协同。建成后显著缩短粤港澳三地时空距离，促进人流物流资金流联通，成为“一国两制”下大湾区建设的标志性工程。该项目着眼国家长远发展，不因短期困难动摇，建成后持续发挥战略作用，证明对认准的国家战略必须保持定力、久久为功、摒弃急功近利、一张蓝图绘到底，彰显谋定后动、行稳致远的战略定力与信心。",
      "document_id": "doc_1101",
      "title": "港珠澳大桥：一张蓝图绘到底的战略定力"
    },
    {
      "abstract": "在贸易保护主义抬头、外部“脱钩断链”压力加大的背景下，中国坚持扩大高水平对外开放、保持战略定力。美方多轮加征关税，但中国始终把发展立足点放在自身、不因外部波动改变发展方针。海关总署数据显示，2024年中国货物贸易进出口总值达43.85万亿元，比上年增长5%，创历史新高。中国主要通过高质量发展拓展新空间：对共建“一带一路”国家贸易占比持续提升，跨境电商、新能源汽车等“新三样”出口快速增长，市场多元化水平显著提高。中国经济的韧性与底气来自完整产业体系和巨大市场空间，是坚持对外开放、于变局中开辟新局面的生动实践。",
      "document_id": "doc_1102",
      "title": "面对“脱钩”压力：中国外贸逆势创历史新高"
    }
  ],
  "id": "node_m04",
  "importance": 4,
  "keywords": [
    "保持战略定力"
  ],
  "name": "保持战略定力",
  "pictures": [],
  "revision": 3,
  "schema_version": "1.0",
  "status": "draft",
  "tags": [
    "学习纲要",
    "补充"
  ],
  "test": [
    {
      "description": "关于「战略定力」的核心内涵及其与「因循守旧」的本质区别，下列说法正确的是（　）：A.战略定力是在复杂形势下保持发展方向、道路、原则的稳定性与坚定性，不为一时一事所扰、不为局部问题所惑，坚持既有战略判断不摇摆，并建立在科学分析矛盾与形势的基础上，与因循守旧的本质区别在于有战略谋划并能依据形势作战略相机调整。 B.战略定力就是固守原有一切做法，与因循守旧、消极无为完全相同。 C.战略定力等于排斥任何调整，无须科学分析形势。 D.战略定力只是某一项具体政策的小节，属于纯战术问题而非方法论问题。",
      "style": "单选题",
      "test_id": "test_1636"
    },
    {
      "description": "判断下列说法是否正确：保持战略定力，就是要求在一切情况下保持既有政策完全不变、绝不作任何调整。",
      "style": "判断题",
      "test_id": "test_1637"
    },
    {
      "description": "某地区在推进产业转型升级中，短期内出现经济增速放缓、个别项目受阻，部分干部主张放弃既定方向、盲目改换赛道。运用「保持战略定力」的知识分析，正确的态度是（　）：A.应坚持既定转型升级方向，不因短期波动动摇战略判断，科学看待短期困难是改革发展中的阶段性、局部性问题，并把战略定力与积极作为相结合、狠抓当前关键工作、攻坚克难，而非盲目改换赛道或消极观望。 B.既然短期困难出现，就应立即完全放弃原定方向、随意改换新领域。 C.战略定力意味着对短期困难和挑战消极等待、不作为。 D.转型升级方向不确定，只要短期增速放缓就应随时改变战略方向。",
      "style": "单选题",
      "test_id": "test_1638"
    },
    {
      "description": "面对百年未有之大变局，党中央强调既要坚持稳中求进工作总基调、保持战略定力，又要根据形势变化及时优化完善政策举措。对「保持战略定力」中「变」与「不变」的辩证关系，下列说法正确的是（　）：A.“不变”指战略方向、原则、总体判断保持稳定，“变”指具体政策举措、工作方式随形势优化完善，二者辩证统一，以不变引领变、以变保障不变的实现。 B.保持战略定力就是一切都不变，具体举措也绝不能有任何调整。 C.“变”与“不变”相互对立、彼此排斥，只能二选一。 D.战略判断是随意变动的，无须保持总体稳定。",
      "style": "单选题",
      "test_id": "test_1639"
    }
  ],
  "updated_at": "2026-08-15T16:18:49Z"
}