{
  "abstract": "背靠祖国、联通世界是港澳优势，须对接国家战略、融入粤港澳大湾区，以港澳所长服务国家所需。",
  "aliases": [
    "港澳融入国家大局",
    "粤港澳大湾区",
    "港澳优势"
  ],
  "assessment": {
    "learning_objectives": [
      "能够理解背靠祖国联通世界是港澳独特优势",
      "说明港澳融入国家发展大局的作用与路径",
      "能够分析粤港澳大湾区建设对港澳繁荣稳定的意义"
    ]
  },
  "difficulty": 3,
  "documents": [
    {
      "abstract": "背靠祖国、联通世界是港澳显著优势，对港澳来说一国两制是最大优势、国家改革开放是最大舞台、共建一带一路和粤港澳大湾区建设是新的重大机遇。行动上要积极主动助力国家全面开放，以港澳所长对接国家所需，提升香港国际金融航运贸易中心地位、加快建设国际创新科技中心，加强澳门世界旅游休闲中心和中葡商贸服务平台建设，打造国家双向开放重要桥头堡；积极主动参与粤港澳大湾区建设，在三个关税区、三种货币条件下大胆闯试开创新路；积极参与国家治理实践，完善与宪法和基本法实施相关的制度和机制实现良政善治；积极促进国际人文交流，讲好中国故事和港澳故事。港澳将在融入大局中实现更好发展。",
      "document_id": "doc_457",
      "title": "支持香港、澳门融入国家发展大局 · 原文要义"
    },
    {
      "abstract": "支持港澳融入国家发展大局，指发挥港澳背靠祖国、联通世界的显著优势，引导其对接国家战略、服务国家发展。理论前提是：一国两制是港澳最大优势，国家改革开放是最大舞台，共建一带一路、粤港澳大湾区建设等是新的重大机遇。行动方向概括为四个积极主动：助力国家全面开放，以港澳所长对接国家所需，打造双向开放重要桥头堡；参与粤港澳大湾区建设，在三个关税区、三种货币条件下大胆闯大胆试；参与国家治理实践，完善与宪法和基本法实施相关的制度和机制实现良政善治；促进国际人文交流，传播中华优秀文化、讲好中国故事。港澳已纳入国家治理体系，是国家发展不可或缺的力量。",
      "document_id": "doc_458",
      "title": "概念解析/理论背景"
    },
    {
      "abstract": "现实意义在于港澳融入国家发展大局既是保持长期繁荣稳定的根本出路，也是国家改革开放和现代化建设的重要依托：香港是内地最大外资来源地、对外投资最大目的地和对外贸易最大转口地，澳门是双向开放特别是与葡语国家经贸往来的重要平台。实践要求是深化港澳同世界各国各地区及内地的交流合作，把港澳国际联系广泛、专业服务发达的优势同内地市场广阔、产业体系完整的优势结合起来，提升香港国际金融航运中心地位、加快建设国际创新科技中心，加强澳门世界旅游休闲中心和中葡商贸合作服务平台建设。该节点与港澳保持长期稳定、由治及兴相互贯通，是一国两制优势在新时代发挥效能的集中体现。",
      "document_id": "doc_459",
      "title": "实践意义/关联"
    },
    {
      "abstract": "建设粤港澳大湾区是习近平总书记亲自谋划、部署、推动的重大国家战略。在这片“一个国家、两种制度、三个关税区、三种货币”格局并存的土地上，三地携手协同创新打造国际科技创新中心，推动广深港澳科技走廊建设；产业协作优势互补、错位发展构建现代产业体系；探索人才流动、资格互认等制度创新便利港澳居民来内地发展，人流物流资金流信息流加速流动。湾区建设充分展现“一国两制”制度优势，是支持港澳融入国家发展大局的重要平台，为新时代改革开放和高质量发展注入强劲动能。",
      "document_id": "doc_642",
      "title": "粤港澳大湾区建设"
    },
    {
      "abstract": "2018年10月世界最长跨海大桥港珠澳大桥正式通车，成为粤港澳大湾区互联互通大动脉和港澳融入国家发展大局的标志性工程。大桥全长约55公里，将香港、珠海、澳门车程由数小时缩至约45分钟。开通五年累计出入境达3600万人次，车辆通行持续攀升，粤港、港澳往来更加便捷，带动人流物流资金流融合。依托大桥和湾区建设，“一地两检”等政策落地。大桥运营说明支持港澳融入国家发展大局是保持其长期繁荣稳定的根本出路，港澳以“国家所需、港澳所长”深度参与大湾区建设正不断释放新动能。",
      "document_id": "doc_1073",
      "title": "港珠澳大桥开通五年·港澳融入大湾区提速"
    },
    {
      "abstract": "随着粤港澳大湾区建设推进，“北上”成为越来越多香港青年创业就业新选择。深圳前海、广州南沙、珠海横琴等建设了一批港澳青年创新创业基地，出台场地租金减免、住房补贴、税收优惠等政策。仅前海就吸引数千个港澳创业团队和数万名青年注册就业，涵盖金融科技、文创、智能制造等领域；南沙建设创享湾等基地提供一站式服务。许多香港青年表示大湾区市场广阔、机会丰富，实现了个人事业与国家发展对接。这些案例说明支持港澳融入国家发展大局关键要发挥港澳背靠祖国、联通世界的优势，引导青年对接国家战略，以港澳所长服务国家所需。",
      "document_id": "doc_1074",
      "title": "香港青年北上大湾区·前海南沙成创业热土"
    }
  ],
  "id": "node_1506",
  "importance": 4,
  "keywords": [
    "港澳",
    "融入国家大局",
    "粤港澳大湾区",
    "优势互补",
    "双向开放",
    "国家战略"
  ],
  "name": "支持香港、澳门融入国家发展大局",
  "pictures": [],
  "revision": 3,
  "schema_version": "1.0",
  "status": "draft",
  "tags": [
    "港澳实践",
    "融合发展"
  ],
  "test": [
    {
      "description": "关于支持港澳融入国家发展大局的四个\"积极主动\"，下列说法正确的是（　）：A.积极主动助力国家全面开放，积极主动参与粤港澳大湾区建设，积极主动参与国家治理实践、积极主动促进国际人文交流。 B.四个\"积极主动\"只涉及经济领域，与文化、治理无关。 C.港澳应保持封闭、不与内地交流。 D.只有其中一个\"积极主动\"是必要的，其余可以忽略。",
      "style": "单选题",
      "test_id": "test_1481"
    },
    {
      "description": "判断下列说法是否正确：随着内地自身开放水平不断提高，香港、澳门在国家对外开放中的地位和作用将逐步减弱。",
      "style": "判断题",
      "test_id": "test_1482"
    },
    {
      "description": "关于粤港澳大湾区建设对港澳发展的重要意义和推进要求，下列说法正确的是（　）：A.这是党中央立足全局和长远作出的重大决策，是保持港澳长期繁荣稳定的重大举措，对港澳探索发展新路向、开拓发展新空间、增添发展新动力具有重要作用。 B.粤港澳大湾区建设会拉大港澳与内地的差距，不利于港澳发展。 C.湾区建设只需简单复制既有模式，无需创新体制机制。 D.粤港澳三地特点决定其无法实现优势互补。",
      "style": "单选题",
      "test_id": "test_1483"
    },
    {
      "description": "关于以\"港澳所长\"对接\"国家所需\"、发挥港澳优势服务全面建设社会主义现代化国家，下列说法正确的是（　）：A.发挥香港国际金融、航运、贸易中心和建设国际创新科技中心等优势，发挥澳门世界旅游休闲中心、中葡商贸合作服务平台等优势，把港澳优势同内地优势相结合，打造双向开放重要桥头堡。 B.港澳应完全脱离内地，各自独立发展。 C.只需发挥香港优势，澳门优势可以忽略。 D.港澳发展只服务自身，与国家现代化建设无关。",
      "style": "单选题",
      "test_id": "test_1484"
    }
  ],
  "updated_at": "2026-08-15T16:18:49Z"
}