{
  "abstract": "政治安全是国家安全的根本，是应对各领域安全风险挑战的首要任务，核心是坚定维护政权安全、制度安全和意识形态安全。",
  "aliases": [
    "政治安全",
    "维护政治安全"
  ],
  "assessment": {
    "learning_objectives": [
      "能够理解政治安全是国家安全的根本",
      "能够说明维护政治安全的首要地位",
      "能够理解政权、制度、意识形态安全的统一要求"
    ]
  },
  "difficulty": 3,
  "documents": [
    {
      "abstract": "构建统筹各领域安全的新安全格局，必须把维护政治安全作为首要任务，因为政治安全是国家安全的根本，涉及主权、政权、制度和意识形态的稳固，是一切国家生存发展的基础条件，并在国家安全肌体中居于\"心脏\"地位。维护政权安全要毫不动摇坚持和巩固党的领导和长期执政地位，不搞三权分立、多党轮流坐庄；维护制度安全要毫不动摇坚持和完善中国特色社会主义制度，防范敌对势力把西方政治制度植入我国；维护意识形态安全要坚持马克思主义在意识形态领域的指导地位，落实意识形态工作责任制。政治安全与人民安全、国家利益至上有机统一，共同保障国家长治久安。",
      "document_id": "doc_400",
      "title": "把维护政治安全放在首要位置 · 原文要义"
    },
    {
      "abstract": "政治安全是国家安全的根本，是构建统筹各领域安全新安全格局的首要任务，涉及主权、政权、制度和意识形态的稳固，是一切国家生存发展的基础条件。教材以\"心脏\"比喻其在国家安全肌体中的地位，政治安全决定和影响经济、军事、社会等各领域安全。维护政治安全包括三个层面：维护政权安全在于坚持和巩固党的领导和长期执政地位，不搞三权分立、多党轮流坐庄；维护制度安全在于坚持和完善中国特色社会主义制度，防范敌对势力颠覆政治制度特别是政党制度的图谋；维护意识形态安全在于坚持马克思主义在意识形态领域的指导地位。三者与人民安全、国家利益至上有机统一。",
      "document_id": "doc_401",
      "title": "把维护政治安全放在首要位置——概念解析与理论背景"
    },
    {
      "abstract": "把维护政治安全放在首要位置，为应对各领域安全风险挑战提供了根本方向。政治安全决定其他领域安全，抓住它就把握了国家安全工作的\"牛鼻子\"。实践要求：维护政权安全上始终把握正确政治方向、坚定政治立场，绝不犯战略性、颠覆性错误；维护制度安全上保持政治定力、坚定制度自信，防范敌对势力植入西方政治制度和政党制度的图谋；维护意识形态安全上落实意识形态工作责任制，把领导权、管理权、话语权牢牢掌握在党的手中，对各类政治性、原则性、导向性问题敢抓敢管。它与\"总体国家安全观以政治安全为根本\"一脉相承，是总体国家安全观的首要抓手。",
      "document_id": "doc_402",
      "title": "把维护政治安全放在首要位置——实践意义与关联"
    },
    {
      "abstract": "2014年4月15日习近平总书记在中央国家安全委员会首次会议上提出总体国家安全观，强调以人民安全为宗旨、以政治安全为根本，把政治安全置于国家安全体系首要位置，明确其他领域安全最终都同政治安全关联。此后统筹推进经济、文化、社会、科技、网络、生态等各领域安全，走出中国特色国家安全道路。2015年新《国家安全法》将总体国家安全观以法律形式确立并设全民国家安全教育日。这一观念为维护国家主权、安全、发展利益提供了根本遵循。",
      "document_id": "doc_919",
      "title": "总体国家安全观：把政治安全放在首位"
    },
    {
      "abstract": "2015年7月1日第十二届全国人大常委会通过新修订的《国家安全法》，将总体国家安全观上升为法律，明确维护国家安全的核心理维护党的领导和政权、制度安全。该法确立国家安全领导体制，规范各领域制度，规定每年4月15日为全民国家安全教育日。此后先后出台《反间谍法》《网络安全法》《数据安全法》《生物安全法》等，构建严密法律体系，反间谍、反颠覆、反分裂斗争持续开展，为防范化解风险、巩固党的执政地位和国家长治久安提供坚实法治支撑，是维护国家政治安全的根本大法。",
      "document_id": "doc_920",
      "title": "《国家安全法》施行：为维护国家政权与制度安全提供法治保障"
    },
    {
      "abstract": "意识形态安全是国家政治安全的重要组成部分。我国坚持马克思主义在意识形态领域指导地位，旗帜鲜明反对历史虚无主义，加强网络、出版、广播影视阵地建设。针对错误思潮依法加强网络内容治理、压实平台责任、清理有害信息。主流媒体加快融合向群众传播党的声音，高校推动思政课改革创新，学校家庭社会协同育人。通过壮大主流思想舆论、唱响主旋律，有效抵御有害思想渗透，维护意识形态和文化安全，说明必须把意识形态工作领导权牢牢掌握在手中。",
      "document_id": "doc_921",
      "title": "守好意识形态安全“南大门”：加强宣传思想阵地建设"
    }
  ],
  "id": "node_1305",
  "importance": 5,
  "keywords": [
    "政治安全",
    "政权安全",
    "制度安全",
    "意识形态安全",
    "国家安全根本"
  ],
  "name": "把维护政治安全放在首要位置",
  "pictures": [],
  "revision": 3,
  "schema_version": "1.0",
  "status": "draft",
  "tags": [
    "总体国家安全观",
    "重点领域"
  ],
  "test": [
    {
      "description": "关于政治安全的内涵与地位，下列说法正确的是（　）：A.政治安全只涉及政权问题，与制度和意识形态无关。 B.政治安全涉及国家主权、政权、制度和意识形态的稳固，是国家安全的根本、一切国家生存发展的基础条件，教材将其比作国家安全肌体的“心脏”，政治安全决定和影响其他领域安全。 C.政治安全与其他领域安全相互独立，政治安全不影响其他领域。 D.政治安全地位无关紧要，只是众多安全领域中的一个普通方面。",
      "style": "单选题",
      "test_id": "test_1391"
    },
    {
      "description": "判断下列说法是否正确：只要经济安全稳固了，政治安全自然就有了保障，因而无需把政治安全单独放在首要位置。",
      "style": "判断题",
      "test_id": "test_1392"
    },
    {
      "description": "教材指出，境内外敌对势力对我国的颠覆破坏往往以颠覆我国的政治制度特别是政党制度为目标。对这一规律，关于维护制度安全的启示，下列说法正确的是（　）：A.这一规律说明只要军事力量强大，制度安全就无忧。 B.应当认识到政治斗争聚焦于政治制度和政党制度的深层次原因，必须毫不动摇坚持和完善中国特色社会主义制度，保持政治定力、坚定制度自信，防范西方政治制度和政党制度植入我国。 C.少数敌对行为无碍大局，无需重视制度安全。 D.为消除颠覆风险，可以放弃中国特色社会主义制度、照搬西方政党制度。",
      "style": "单选题",
      "test_id": "test_1393"
    },
    {
      "description": "材料：教材指出，搞乱一个社会、颠覆一个政权，往往先从意识形态领域打开缺口，思想防线被攻破后其他防线就很难守住。关于维护意识形态安全的极端重要性，下列说法正确的是（　）：A.意识形态安全只关乎文化领域，与政权和社会稳定无关。 B.意识形态事关举什么旗、走什么路的重大问题，是其他防线的前提和基础；必须坚持马克思主义在意识形态领域的指导地位，落实意识形态工作责任制，牢牢掌握领导权、管理权、话语权。 C.思想防线被攻破不影响其他防线，二者互不相关。 D.维护意识形态安全只需抓好宣传工作即可，无需走社会主义道路。",
      "style": "单选题",
      "test_id": "test_1394"
    },
    {
      "description": "关于政治安全、人民安全、国家利益至上三者之间的关系，下列说法正确的是（　）：A.三者相互独立、彼此割裂，只要抓好其中一个即可。 B.政治安全是维护人民安全和国家利益的根本保证，人民安全居于中心地位、国家安全归根到底是保障人民利益，国家利益至上是实现政治安全和人民安全的要求和原则，三者统一于确保党的长期执政、人民安居乐业、国家长治久安。 C.国家利益至上完全可以取代政治安全和人民安全。 D.三者相互矛盾，难以统筹兼顾。",
      "style": "单选题",
      "test_id": "test_1395"
    }
  ],
  "updated_at": "2026-08-15T16:18:49Z"
}