{
  "abstract": "共建一带一路是推动构建人类命运共同体的实践平台，秉持共商共建共享原则，坚持开放、绿色、廉洁理念，以高标准、可持续、惠民生为目标，是造福沿线各国人民的大事业。",
  "aliases": [
    "一带一路",
    "一带一路倡议",
    "高质量共建一带一路"
  ],
  "assessment": {
    "learning_objectives": [
      "能够理解共建一带一路的原则理念和目标",
      "能够说明一带一路建设的核心内涵与最高目标",
      "能够理解高质量共建一带一路对构建人类命运共同体的意义"
    ]
  },
  "difficulty": 2,
  "documents": [
    {
      "abstract": "共建一带一路是推动构建人类命运共同体的实践平台，旨在造福各国人民、促进世界和平与共同繁荣。2013年习近平提出建设丝绸之路经济带和21世纪海上丝绸之路倡议，秉持共商共建共享原则，坚持开放、绿色、廉洁理念，以高标准、可持续、惠民生为目标，推进政策沟通、设施联通、贸易畅通、资金融通、民心相通，建设和平、繁荣、开放、绿色、创新、文明之路。它是经济合作倡议和国际公共产品，不针对谁也不排除谁，不以意识形态划界、不搞零和游戏。经持续努力已从夯基垒台到落地生根，把硬联通作为方向、软联通作为支撑、心联通作为基础，绘就大写意并正绘制工笔画。面向未来需夯实根基、拓展合作、强化风险防控，更好服务构建新发展格局，推动其沿高质量发展方向前进。",
      "document_id": "doc_499",
      "title": "高质量共建\"一带一路\" · 原文要义"
    },
    {
      "abstract": "高质量共建一带一路是对中国与世界实现开放共赢路径的顶层设计，是推动构建人类命运共同体的实践平台。2013年习近平提出建设丝绸之路经济带和21世纪海上丝绸之路倡议，根植历史、面向未来，源于中国、属于世界。其原则、理念与目标可概括为秉持共商共建共享原则，坚持开放、绿色、廉洁理念，以高标准、可持续、惠民生为目标，推进政策沟通、设施联通、贸易畅通、资金融通、民心相通五通。核心内涵是促进基础设施建设和互联互通、加强经济政策协调和发展战略对接；最高目标是各方携手应对世界经济挑战、开创发展新机遇，朝人类命运共同体方向迈进。它本质是经济合作倡议和国际公共产品，不针对谁也不排除谁。",
      "document_id": "doc_500",
      "title": "概念解析/理论背景 | 高质量共建一带一路"
    },
    {
      "abstract": "高质量共建一带一路为各国带来实打实、沉甸甸的实惠，是构建人类命运共同体的最大实践平台。实践路径可概括为把基础设施硬联通作为重要方向、把规则标准软联通作为重要支撑、把同共建国家人民心联通作为重要基础，既服务构建新发展格局，又推动制度型开放，让发展成果惠及各方。它也需澄清误解：这是经济合作倡议而非地缘政治联盟或军事同盟，是开放包容进程而非中国俱乐部或所谓陷阱，不以意识形态划界、不搞零和游戏。它作为国际公共产品，与外交为民的民心沟通、与积极参与全球治理、与构建人类命运共同体五个世界目标紧密关联，是联通中国发展与世界发展的关键纽带。",
      "document_id": "doc_501",
      "title": "实践意义/关联"
    },
    {
      "abstract": "2023年10月，连接印尼首都雅加达与万隆的雅万高铁正式通车，这是中国高铁首次全系统、全要素、全产业链在海外落地，是中印尼共建“一带一路”的标志性工程。铁路全长约142公里、最高设计时速350公里，将两地行程从3个多小时压缩至约40分钟。建设过程中中国以自主知识产权动车组和先进标准，克服了火山地质、复杂气候等难题。通车一年来累计发送旅客屡创新高，被印尼称为“东南亚第一条高速铁路”。作为样板项目，它输出了中国技术、中国标准，促进当地就业与人才培养，是高质量共建“一带一路”互联互通的生动典范。",
      "document_id": "doc_719",
      "title": "雅万高铁：中国高铁首次全系统走出国门的“金字招牌”"
    },
    {
      "abstract": "2021年12月3日中老铁路全线通车，北起昆明南至万象，全长约1035公里，是首条以中方为主投资建设、全线采用中国技术标准并与中国铁路网直接连通的国际铁路。通车以来客货两旺，被称“黄金大通道”，截至2025年累计发送旅客超6000万人次、开行货物列车6.3万列、运输货物突破7100万吨，极大改变老挝“陆锁国”历史使其成为“陆联国”，并带动沿线旅游、物流、就业。中方坚持“授人以渔”，培养大量老挝本土铁路技术人员。中老铁路是中老命运共同体建设的标志性工程，也是“一带一路”倡议同老挝发展战略对接的成功实践，诠释了互联互通对促进区域减贫与共同发展的巨大价值。",
      "document_id": "doc_720",
      "title": "中老铁路：“黄金大通道”惠及沿线民众"
    },
    {
      "abstract": "中老铁路北起云南昆明、南至老挝首都万象，全长约1035公里，2021年12月3日全线开通运营，是第一条采用中国标准、中国技术并直接与中方铁路网联通的中老国际铁路。开通以来客货运量持续攀升，截至2025年累计发送旅客超6000万人次，开行货物列车6.3万列、运输货物突破7100万吨，其中跨境货物1600万吨，辐射中国及东盟等19个国家和地区，货物品类达3700多种。磨憨—磨丁口岸出入境人员逐年增长，使一度沦为陆锁国的老挝跃升为区域互联互通的陆联国，显著改善老挝民生，是高质量共建一带一路、促进共同发展的样板工程。",
      "document_id": "doc_1178",
      "title": "中老铁路——高质量共建“一带一路”的示范性民生工程"
    }
  ],
  "id": "node_1611",
  "importance": 4,
  "keywords": [
    "共商共建共享",
    "五通",
    "三联通",
    "国际公共产品",
    "互利共赢"
  ],
  "name": "高质量共建\"一带一路\"",
  "pictures": [],
  "revision": 4,
  "schema_version": "1.0",
  "status": "draft",
  "tags": [
    "一带一路",
    "共同发展"
  ],
  "test": [
    {
      "description": "关于高质量共建'一带一路'的原则、理念和目标，下列说法正确的是（　）：A.共建'一带一路'秉持共商共建共享原则。 B.共建'一带一路'奉行排他、垄断的封闭理念。 C.共建'一带一路'以实现单一国家利益为目标，无需惠及他国。 D.共建'一带一路'不追求'五通'，只追求基础设施建设。",
      "style": "单选题",
      "test_id": "test_1548"
    },
    {
      "description": "判断下列说法是否正确：共建'一带一路'是中国打造的排他性地缘政治联盟或军事同盟。",
      "style": "判断题",
      "test_id": "test_1549"
    },
    {
      "description": "关于硬联通、软联通、心联通在共建'一带一路'中的含义与作用，下列说法正确的是（　）：A.硬联通指基础设施，是共建'一带一路'的重要方向；软联通指规则标准，是重要支撑；心联通指同各国人民心相连，是重要基础。 B.硬联通指人员往来，软联通指资金融通，二者与基础设施无关。 C.只要建成硬联通就够了，软联通和心联通无足轻重。 D.三种联通内容完全相同，彼此没有区别。",
      "style": "单选题",
      "test_id": "test_1550"
    },
    {
      "description": "判断下列说法是否正确：共建'一带一路'是中国设下的'债务陷阱'。",
      "style": "判断题",
      "test_id": "test_1551"
    },
    {
      "description": "判断下列说法是否正确：'一带一路'建设从大写意走向精谨细腻的工笔画，意味着要继续夯实根基、拓展新领域。",
      "style": "判断题",
      "test_id": "test_1552"
    }
  ],
  "updated_at": "2026-08-18T16:20:39Z"
}