{
  "abstract": "新时代全面深化改革开放就其艰巨性、复杂性和系统性来说是一场深刻革命，须啃硬骨头、涉险滩，全面系统整体推进、取得历史性成就。",
  "aliases": [
    "深刻革命",
    "全面深化改革",
    "改革攻坚战"
  ],
  "assessment": {
    "learning_objectives": [
      "能够理解新时代全面深化改革开放为何是一场深刻革命",
      "能够说明全面深化改革涉险滩、闯难关的特点",
      "能够把握全面系统整体推进改革的要求"
    ]
  },
  "difficulty": 4,
  "documents": [
    {
      "abstract": "新时代全面深化改革开放就其艰巨性、复杂性和系统性而言是一场深刻的革命。经过多年改革，容易的已基本完成，剩下的都是难啃的硬骨头，深层次矛盾加剧、利益固化藩篱高筑。它是一场思想理论、改革组织方式、国家制度和治理体系、人民广泛参与的深刻变革，从夯基垒台到积厚成势再到加强系统集成，推动许多领域历史性变革、系统性重塑、整体性重构。须坚持和完善基本经济制度、对外开放制度机制、人民当家作主制度体系、文化制度、民生保障和社会治理制度、生态文明制度以及党的领导和党的建设制度体系等。它不是修修补补，而是全面、系统、整体的制度创新。新时代改革开放是全方位、深层次、根本性的，成就历史性、革命性、开创性，体现中国特色社会主义制度的鲜明特征和显著优势。",
      "document_id": "doc_133",
      "title": "新时代全面深化改革开放是一场深刻革命 · 原文要义"
    },
    {
      "abstract": "教材将新时代全面深化改革开放界定为“一场深刻的革命”，这里的“革命”是广义的、制度性的变革，就艰巨性、复杂性和系统性而言，并非暴力政治革命。之所以称“革命”，在于改革进入涉险滩、闯难关的攻坚期：容易的、皆大欢喜的改革已完成，剩下都是难啃的硬骨头，深层次矛盾加剧、利益固化藩篱高筑。理论内涵上，它是一场思想理论、改革组织方式、国家制度和治理体系、人民广泛参与的深刻变革，从夯基垒台到积厚成势再到系统集成，推动许多领域历史性变革、系统性重塑、整体性重构。“革命”与“改良”相对，强调它不是修修补补，而是在多年改革开放基础上的全面、系统、整体的制度创新，是刀刃内向、敢于自我革命的体现，要求全党勇于破除条条框框，构建系统完备、科学规范、运行有效的制度体系。",
      "document_id": "doc_134",
      "title": "概念解析/理论背景：'深刻革命'的必然性与内涵"
    },
    {
      "abstract": "将全面深化改革定性为\"深刻革命\"，实践上要求以更大政治勇气和系统观念推进改革。各领域改革紧密联系、相互交融，必须配套协调防止相互掣肘，打破部门利益、行业利益以服从国家整体利益和改革发展稳定大局；它与党的自我革命精神相通，强调刀刃向内、敢于担当。这一\"革命\"是落实总目标的过程性表述，通过全面制度创新坚持和完善社会主义基本经济制度、人民当家作主制度、法治体系等各方面制度。党中央集中统一领导是推进革命的组织保障。需辨析的是，革命性不等于推倒重来，其实质仍是社会主义制度的自我完善，须与坚持正确方向相衔接。",
      "document_id": "doc_135",
      "title": "实践意义/关联：以革命姿态破解攻坚期难题"
    },
    {
      "abstract": "2013年12月30日中央全面深化改革领导小组成立，总书记亲自担任组长，从顶层设计谋划改革全局。2018年3月根据党的十九届三中全会部署，中央深改领导小组改设为中央全面深化改革委员会。从领导小组到委员会的一词之变，昭示全面深化改革进入新阶段，把党对改革的集中统一领导提升到更高层次，更充分发挥党总揽全局、协调各方的领导核心作用。无论经济、政治、文化等各领域改革纵深推进还是重点领域攻坚突破，都依赖这一决策指挥中枢的科学统筹。深改领导小组和深改委的接续运转，是新时代改革开放再出发、将改革进行到底的坚强组织保证。",
      "document_id": "doc_616",
      "title": "从'领导小组'到'委员会'：改革指挥中枢的升级"
    },
    {
      "abstract": "全面深化改革要敢于啃硬骨头，长江十年禁渔正是这样的深刻革命。长期过度捕捞使江豚濒临灭绝，长江无鱼警报拉响。2020年1月起长江流域332个水生生物保护区率先禁捕，2021年1月1日零时起长江十年禁渔全面启动，涉及沿江10省46万平方公里。禁渔背后是艰巨系统改革：17万艘渔船退捕上岸、23万多名渔民转产转业，国家给予退捕补助，通过技能培训、公益岗位、产业帮扶确保退得出稳得住能致富，并建立健全禁捕执法和水生生物资源养护机制。成效显著，渔获物回升、江豚数量止跌回升、刀鱼种群恢复。这场生态革命以体制机制突破破解治渔乱局，是新时代改革破难题开新局、人与自然和谐共生的深刻变革。",
      "document_id": "doc_1023",
      "title": "长江十年禁渔——改革攻坚、啃下生态治理‘硬骨头’"
    },
    {
      "abstract": "党的十八大以来，党中央把简政放权、放管结合、优化服务作为转变政府职能的先手棋。国务院取消下放大量行政审批事项，全面实施市场准入负面清单，企业开办时间从20多天压缩到1天以内且全程网办；推行证照分离、多证合一，开展电子证照互认和跨省通办，数百项高频事项实现一网通办。各地推出最多跑一次等品牌，大幅降低制度性交易成本，全国市场主体突破1.8亿户，营商环境全球排名显著跃升。放管服改革厘清政府与市场边界，以制度创新破解办事难慢、多头跑等顽疾，是改革攻坚啃硬骨头、激发市场活力的深刻革命，为高质量发展注入强劲动力。",
      "document_id": "doc_1024",
      "title": "深化改革‘放管服’——简政放权啃下营商环境硬骨头"
    }
  ],
  "id": "node_0502",
  "importance": 5,
  "keywords": [
    "深刻革命",
    "艰巨复杂性",
    "系统集成",
    "硬骨头",
    "涉险滩"
  ],
  "name": "新时代全面深化改革开放是一场深刻革命",
  "pictures": [],
  "revision": 3,
  "schema_version": "1.0",
  "status": "draft",
  "tags": [
    "改革开放",
    "深刻革命",
    "新时代"
  ],
  "test": [
    {
      "description": "关于教材赋予新时代全面深化改革开放'一场深刻革命'这一性质时'革命'的含义，下列说法正确的是（　）：A.它指通过暴力手段推翻现行制度的政治革命。 B.它指涉及全局的深层制度变革，靠巨大的政治勇气啃硬骨头、涉险滩。 C.它指对生产生活的细枝末节进行修补性的调整。 D.它指完全抛弃已有制度、另起炉灶的彻底重建。",
      "style": "单选题",
      "test_id": "test_966"
    },
    {
      "description": "判断下列说法是否正确：新时代全面深化改革开放既然是'一场深刻革命'，就意味着要推倒重来、另起炉灶。",
      "style": "判断题",
      "test_id": "test_967"
    },
    {
      "description": "任何领域的改革都会牵动其他领域。关于新时代为什么必须配套推进各领域改革，下列说法正确的是（　）：A.各领域改革彼此独立、互不影响，只需各自推进即可。 B.改革不配套会造成相互掣肘、改革难以推进，因而要整体谋划、协同推进、系统集成。 C.只要抓好其中一个重要领域改革，其他领域就能自然完成。 D.各领域改革应当各自为战、突出部门局部利益。",
      "style": "单选题",
      "test_id": "test_968"
    },
    {
      "description": "教材以'硬骨头''涉险滩'比喻新时代改革。对这一比喻所揭示的客观形势，下列说法正确的是（　）：A.改革已进入攻坚期、深水区，浅层矛盾已经解决，深层次矛盾和利益固化藩篱凸显。 B.改革已基本完成，只剩程序性收尾工作。 C.改革面临的都是轻松易行的浅层问题。 D.改革已无任何体制机制障碍需要破除。",
      "style": "单选题",
      "test_id": "test_969"
    },
    {
      "description": "关于新时代改革开放必须勇于做到的事项及其共同指向，下列说法正确的是（　）：A.必须勇于破除不合时宜的思维定势和部门本位、条条框框等障碍，共同指向构建符合国家和人民利益的新格局。 B.必须勇于照搬西方制度模式，以最快速度完成改革。 C.不必触碰深层矛盾，只保留现有体制机制即可。 D.仅在对外开放领域作表面调整即可。",
      "style": "单选题",
      "test_id": "test_970"
    }
  ],
  "updated_at": "2026-08-15T16:18:49Z"
}