{
  "abstract": "按劳分配为主体、多种分配方式并存是我国基本分配制度，有利于调动各方面积极性、实现效率和公平有机统一，须坚持和完善。",
  "aliases": [
    "基本分配制度",
    "按劳分配",
    "分配方式"
  ],
  "assessment": {
    "learning_objectives": [
      "能够说明基本分配制度由我国基本国情与所有制决定",
      "能够理解按劳分配为主体与生产要素参与分配的关系",
      "能够把握完善分配制度促进收入分配更合理更有序的路径"
    ]
  },
  "difficulty": 4,
  "documents": [
    {
      "abstract": "按劳分配为主体、多种分配方式并存是我国基本分配制度，由社会主义性质和国情决定。分配决定于生产又反作用于生产，公有制为主体、多种所有制共同发展决定了分配制度的这一安排。劳动是财富创造的活的源泉，要坚守多劳多得、保护劳动所得；同时允许资本、土地、知识、技术、管理、数据等要素参与分配。实践中要推动居民收入增长与经济增长同步、劳动报酬提高与劳动生产率提高同步，实现效率和公平有机统一。",
      "document_id": "doc_172",
      "title": "坚持按劳分配为主体、多种分配方式并存 · 原文要义"
    },
    {
      "abstract": "按劳分配为主体、多种分配方式并存是宪法明确的基本分配制度。其理论逻辑在于参与生产的方式决定参与分配的形式：公有制为主体、多种所有制共同发展决定分配上要坚持按劳分配为主体、多种分配方式并存。劳动是财富创造的活的源泉，应坚守多劳多得、保护劳动所得；资本、土地、知识、技术、数据等要素也发挥作用，应允许参与分配。此安排调动积极性、实现效率和公平统一，理解时需辨清所有制与分配的逻辑链条。",
      "document_id": "doc_173",
      "title": "概念解析/理论背景"
    },
    {
      "abstract": "坚持和完善基本分配制度，实践上要推动居民收入增长与经济增长同步、劳动报酬提高与劳动生产率提高同步。具体要健全工资决定和正常增长机制、工资集体协商制度，提高劳动报酬在初次分配中的比重；健全生产要素按市场贡献决定报酬的机制，建立健全数据权属规则。这一节点是分配制度维度的核心，与所有制、市场经济体制相互支撑，其落实有利于实现效率公平统一、促进共同富裕，与高质量发展和新发展格局的目标内在一致。",
      "document_id": "doc_174",
      "title": "实践意义/关联"
    },
    {
      "abstract": "改革开放40多年来民营经济贡献巨大，常用56789概括其地位：贡献50%以上税收、60%以上GDP、70%以上技术创新成果、80%以上城镇劳动就业、90%以上企业数量。总书记明确指出民营企业和民营企业家是自己人，要坚持两个毫不动摇、优化民营经济发展环境、促进其发展壮大；加强反垄断、防止资本无序扩张不是打压民营经济，而是完善市场经济体制、维护公平竞争秩序，让各类市场主体在法治化规范化环境中发展。56789既是成绩单又是动员令，昭示着民营经济在中国式现代化进程中大有可为。",
      "document_id": "doc_613",
      "title": "民营经济的'56789'"
    },
    {
      "abstract": "坚持按劳分配为主体、多种分配方式并存是我国基本分配制度，安徽铜陵的实践让技能要素显性化参与分配，成为多劳多得的鲜活案例。针对高技能人才短缺、技能价值未充分体现，铜陵市推动企业把薪酬与技能等级、技能贡献挂钩，设立技能津贴和技能工资单元实现技高薪涨，将技能等级证书对应薪酬、技能竞赛成绩和技术革新成果纳入绩效分配，工人还可通过以技入股、参与创新项目获得分红。据工人日报报道，铜陵多家企业职工技能工资增幅明显，技能人才年均收入增长可观。这一做法使按劳分配从按岗位拿钱走向按技能按贡献计酬，促进产业工人队伍建设，为制造业高质量发展提供人才支撑。",
      "document_id": "doc_1031",
      "title": "安徽铜陵：技能要素参与分配，让“技高者多得”"
    },
    {
      "abstract": "优化收入分配政策重在让劳动者少缴税、多增收。2023年8月国家提高婴幼儿照护、子女教育、赡养老人三项个税专项附加扣除标准，其中赡养老人由每月2000元提至3000元，自2023年1月起施行。以重庆为例，2023年三项专项附加扣除合计减税近40亿元，惠及约260万市民，人均减税超1500元。政策精准瞄准上有老下有小的家庭，真金白银减轻抚养赡养负担，增加工薪阶层可支配收入。专项附加扣除通过税制调节作用于分配环节，与按劳分配形成互补，既坚持按劳分配为主体又兼顾多方面公平，是加强普惠性、基础性、兜底性民生建设的体现。",
      "document_id": "doc_1032",
      "title": "重庆“一老一小”专项附加扣除：税改红利直达民生钱包"
    }
  ],
  "id": "node_0606",
  "importance": 4,
  "keywords": [
    "按劳分配",
    "分配制度",
    "分配方式",
    "效率与公平",
    "生产要素"
  ],
  "name": "坚持按劳分配为主体、多种分配方式并存",
  "pictures": [],
  "revision": 3,
  "schema_version": "1.0",
  "status": "draft",
  "tags": [
    "基本经济制度",
    "分配制度",
    "共同富裕"
  ],
  "test": [
    {
      "description": "关于我国必须坚持按劳分配为主体、多种分配方式并存的原因，下列说法正确的是（　）：A.全民所有制、集体所有制等多种所有制共同发展，决定了只能实行单一的按劳分配。 B.参与生产的一定方式决定参与分配的形式，公有制为主体、多种所有制经济共同发展决定了按劳分配为主体、多种分配方式并存。 C.采用哪种分配制度完全取决于人们的主观愿望，与所有制无关。 D.既然允许多种分配方式并存，按劳分配就可以被取消，不再具有主体地位。",
      "style": "单选题",
      "test_id": "test_1030"
    },
    {
      "description": "判断下列说法是否正确：坚持按劳分配为主体，就不能允许资本参与分配，否则就有违社会主义分配原则。",
      "style": "判断题",
      "test_id": "test_1031"
    },
    {
      "description": "关于'两个同步'即'居民收入增长和经济增长同步、劳动报酬提高和劳动生产率提高同步'的落实，下列说法正确的是（　）：A.只要经济总量增长，居民收入和劳动报酬就会自然同步增长，无需制度安排。 B.应健全工资决定和正常增长机制、完善企业工资集体协商制度，提高劳动报酬在初次分配中的比重。 C.提高劳动报酬可以牺牲劳动生产率，二者不可兼顾。 D.'两个同步'仅仅是一种宣传口号，无需落实到收入分配制度中。",
      "style": "单选题",
      "test_id": "test_1032"
    },
    {
      "description": "关于更好实现知识、技术、管理、数据等要素的价值，下列说法正确的是（　）：A.各类要素的价值由领导指定，与市场无关。 B.应健全生产要素由市场评价贡献、按贡献决定报酬的机制，并强化以增加知识价值为导向的收入分配政策。 C.只需提高劳动报酬，不必让其他要素参与分配。 D.数据要素无需建立权属、公开、共享、交易规则。",
      "style": "单选题",
      "test_id": "test_1033"
    },
    {
      "description": "关于我国基本分配制度在促进共同富裕中的作用，下列说法正确的是（　）：A.基本分配制度会加剧收入差距，不利于共同富裕。 B.它有利于调动各方面积极性、实现效率和公平有机统一，促进收入分配更合理更有序，为促进共同富裕提供制度基础。 C.基本分配制度只追求公平，会抑制经济发展的效率。 D.实现共同富裕无需依靠分配制度，只需单纯提高福利。",
      "style": "单选题",
      "test_id": "test_1034"
    }
  ],
  "updated_at": "2026-08-15T16:18:49Z"
}