{
  "abstract": "腐败是危害党的生命力战斗力的最大毒瘤，是党长期执政面临的最大威胁，反腐败是一场输不起决不能输的重大斗争，必须从关系党和国家生死存亡的战略高度坚决遏制腐败。",
  "aliases": [
    "腐败最大威胁",
    "反腐败斗争",
    "腐败最大毒瘤"
  ],
  "assessment": {
    "learning_objectives": [
      "能够理解腐败何以成为党长期执政的最大威胁",
      "能够说明反腐败关乎人心向背和执政基础",
      "能够从战略高度认识坚决遏制腐败的必要性"
    ]
  },
  "difficulty": 2,
  "documents": [
    {
      "abstract": "习近平指出，我们党作为执政党，面临的最大威胁就是腐败。腐败严重侵蚀党的肌体、破坏党的执政基础，是世界上各国面临的共同难题。历史上统治集团严重腐败导致人亡政息的例子比比皆是，若不能遏制腐败蔓延，党必然严重脱离群众、失去信任和支持，动摇甚至丧失执政基础。反腐败是一场输不起也决不能输的重大斗争，必须从关系党和国家生死存亡的战略高度重视，坚持正风肃纪反腐凝聚党心军心民心。腐败还侵蚀党的先进性和纯洁性，党同任何腐败现象水火不容，必须坚决割除滋生在党的肌体上的毒瘤，永葆政治本色。",
      "document_id": "doc_526",
      "title": "腐败是党长期执政面临的最大威胁 · 原文要义"
    },
    {
      "abstract": "腐败是危害党的生命力和战斗力的最大毒瘤，是党长期执政面临的最大威胁。习近平指出执政党面临的最大威胁就是腐败。这一判断有深沉的历史与现实依据：一个政党、一个政权的前途命运最终取决于人心向背，历史上因腐败亡政的例子不胜枚举，人民群众最痛恨腐败和特权现象，它们对党同人民群众血肉联系的杀伤力最大。若不能遏制腐败蔓延，党必然脱离群众、丧失执政基础。腐败还严重侵蚀党的肌体，损害先进性和纯洁性——党代表最广大人民根本利益，同腐败水火不容，必须从关系党和国家生死存亡的战略高度开展反腐败斗争。",
      "document_id": "doc_527",
      "title": "概念解析/理论背景"
    },
    {
      "abstract": "认清腐败「最大威胁」的地位，要求以不得罪成百上千腐败分子就要得罪14亿人民的政治坚定，坚持正风肃纪反腐凝聚党心军心民心、厚植党执政的政治基础；保持每名党员干部清正廉洁、甘当人民公仆，割除滋生在党的肌体上的毒瘤，永葆政治本色。它在实践中确立起开展坚强有力反腐败斗争的紧迫性，为坚持标本兼治、一体推进「三不腐」和永远吹冲锋号提供立论前提，也呼应反腐败取得压倒性胜利但任重道远；并与党的自我革命相连，反腐败是最彻底的自我革命、是全面从严治党的「必答题」。",
      "document_id": "doc_528",
      "title": "实践意义/关联"
    },
    {
      "abstract": "七十多年前毛泽东在延安窑洞对“历史周期率”之问给出第一个答案：“只有让人民来监督政府，政府才不敢松懈。”经过百年奋斗尤其是党的十八大以来的新实践，党又郑重给出第二个答案——自我革命。2022年1月18日十九届中央纪委六次全会上，习近平总书记指出党中央探索出依靠党的自我革命跳出历史周期率的成功路径。人民监督是外因、自我革命是内因，勇于自我革命是中国共产党区别于其他政党的显著标志，党以刀刃向内、刮骨疗毒的决心把“全面从严治党永远在路上”写进百年大党的崭新答卷。",
      "document_id": "doc_648",
      "title": "“窑洞之问”的“第二个答案”——党的自我革命"
    },
    {
      "abstract": "腐败是党长期执政面临的最大威胁。党中央坚持无禁区、全覆盖、零容忍，一体推进不敢腐、不能腐、不想腐。2024年中央纪委国家监委立案审查调查中管干部92人，2025年达181人，金湘军、蓝天立等省部级“大老虎”被查处；同年全国处分88.9万人，整治群众身边“蝇贪蚁腐”；持续推进“猎狐”追逃追赃并启动“天网2024”行动，当年2.5万人主动投案，形成强烈震慑。坚持受贿行贿一起查、执法司法协同联动。反腐败斗争取得压倒性胜利并全面巩固，有力维护了党和政府形象，传递全面从严治党永远在路上的信号。",
      "document_id": "doc_1089",
      "title": "“打虎”“拍蝇”“猎狐”不停步——坚持以雷霆之势惩治腐败"
    },
    {
      "abstract": "警示教育是把纪律规矩挺在前面、一体推进“三不腐”的重要抓手。各级纪检监察机关深挖典型案件资源常态化开展警示：组织党员干部观看《持续发力 纵深推进》等教育片、召开专题民主生活会剖析，驻中管金融和国企纪检组点名道姓通报曝光并督促以案促改，建设廉政教育基地开展沉浸式教育。随着党纪学习教育深化，警示教育与廉洁文化建设融合，清廉机关、清廉医院、清廉村居建设扎实推进。警示教育以案说德、说纪、说法、说责，推动党员干部知敬畏、存戒惧、守底线，从思想源头防范腐败，为夺取反腐败斗争全面胜利提供支撑。",
      "document_id": "doc_1090",
      "title": "以案促改警示教育——筑牢拒腐防变思想防线"
    }
  ],
  "id": "node_1709",
  "importance": 5,
  "keywords": [
    "最大威胁",
    "自我革命",
    "人心向背",
    "执政基础",
    "先进性纯洁性"
  ],
  "name": "腐败是党长期执政面临的最大威胁",
  "pictures": [],
  "revision": 4,
  "schema_version": "1.0",
  "status": "draft",
  "tags": [
    "反腐败",
    "执政风险"
  ],
  "test": [
    {
      "description": "关于为什么说腐败是党长期执政面临的最大威胁，下列说法最准确的是（　）：A.腐败只影响个别干部的声誉，与党的执政地位没有关联。 B.腐败损害党群血肉联系，最具杀伤力，动摇党的执政基础，同时破坏党的先进性和纯洁性。 C.腐败属于难以避免的普遍现象，对长期执政影响有限。 D.只要经济发展、物质丰富，腐败就不会威胁执政地位。",
      "style": "单选题",
      "test_id": "test_1593"
    },
    {
      "description": "判断下列说法是否正确：腐败问题只损害个别干部的形象，对党的整体执政地位和人民的信任没有大的影响。",
      "style": "判断题",
      "test_id": "test_1594"
    },
    {
      "description": "习近平指出「不得罪成百上千的腐败分子，就要得罪14亿人民」。结合这一论断，关于开展反腐败斗争的政治考量，下列说法正确的是（　）：A.反腐败是政治斗争，宁可少惩治腐败分子也要维护个别干部的面子。 B.反腐败是输不起也决不能输的重大政治斗争，宁可惩治腐败分子也要维护十四亿人民的利益和人心。 C.反腐败只是纪委的日常工作，不涉及党的执政全局。 D.反腐败只需惩治高层腐败，不必耗费资源。",
      "style": "单选题",
      "test_id": "test_1595"
    },
    {
      "description": "习近平以「一棵参天大树，如任蛀虫繁衍啃咬，最终必会逐渐枯萎」为喻论述反腐败。这一比喻最好的说明了（　）：A.腐败就像蛀虫啃咬大树，必须及时清除，否则会侵蚀党的肌体、损害先进性和纯洁性。 B.腐败是树木生长自然现象，不必过度干预。 C.腐败只影响个别枝杈，大树依然茁壮。 D.反腐败是短期集中行动，过后即可一劳永逸。",
      "style": "单选题",
      "test_id": "test_1596"
    },
    {
      "description": "关于为什么反对腐败是保持党的先进性和纯洁性的必然要求，下列说法正确的是（　）：A.党代表最广大人民的根本利益，与腐败水火不容。 B.个别党员干部腐败只会影响个人形象，与党的先进性无关。 C.党的先进性和纯洁性与党员个人的清廉状况没有关联。 D.反腐败只是廉政机关的业务问题，不属于党的自我建设要求。",
      "style": "单选题",
      "test_id": "test_1597"
    }
  ],
  "updated_at": "2026-08-18T16:20:39Z"
}