{
  "abstract": "港澳回归后同内地优势互补、共同发展，一国两制实践取得举世公认的成功，保持长期繁荣稳定。",
  "aliases": [
    "港澳繁荣稳定",
    "港澳回归",
    "一国两制成功实践"
  ],
  "assessment": {
    "learning_objectives": [
      "能够概括港澳回归后发展的良好态势",
      "理解一国两制是保持港澳长期繁荣稳定的好制度",
      "能够说明中央和祖国内地对港澳的坚强后盾作用"
    ]
  },
  "difficulty": 2,
  "documents": [
    {
      "abstract": "港澳回归祖国后走上同内地优势互补、共同发展的宽广道路，一国两制实践取得举世公认的成功，证明它是保持港澳繁荣稳定的好制度。党的十八大以来，习近平多次强调一如既往、坚定不移贯彻一国两制方针并保持港澳长期繁荣稳定，从多个方面全力支持港澳发展经济、改善民生、对接国家战略、深化对外交流合作。在中央和内地支持下，香港抵御了国际金融危机和新冠疫情等冲击，国际金融航运贸易中心地位稳固，多次被评为全球最自由经济体第一位；澳门走出具有澳门特色的成功实践道路，人均收入稳居世界前列。港澳政府还加强青少年宪法、基本法、国情和历史教育，使爱国传统薪火相传。",
      "document_id": "doc_451",
      "title": "香港、澳门保持长期稳定发展良好态势 · 原文要义"
    },
    {
      "abstract": "香港、澳门保持长期稳定发展良好态势，指回归祖国后走上同内地优势互补、共同发展的宽广道路，一国两制实践取得举世公认的成功，证明它既是保持港澳繁荣稳定的好制度，也是保障港澳居民根本利益和福祉的好制度。在中央和内地的有力支持下，港澳独特优势和地位不断巩固：香港经济蓬勃发展、防御了多重冲击、多次被评为全球最自由经济体第一位；澳门走出具有澳门特色的成功实践道路，宪制秩序牢固确立、人均收入稳居世界前列。党中央一如既往、坚定不移贯彻一国两制方针，为港澳长期繁荣稳定提供了坚强后盾。",
      "document_id": "doc_452",
      "title": "概念解析/理论背景"
    },
    {
      "abstract": "现实意义在于港澳长期繁荣稳定直接关系强国建设、民族复兴大局。实践要求中央一如既往支持行政长官和特别行政区政府依法施政，支持港澳抓住国家发展历史机遇，主动对接十四五规划、粤港澳大湾区建设和一带一路高质量发展等国家战略，破除利益固化藩篱释放发展活力，同时加强青少年宪法基本法、国情、中国历史和中华文化教育，使爱国爱港爱澳传统薪火相传。该节点是一国两制成功实践的生动体现，与由乱到治、融入国家发展大局等节点相互印证，为坚定制度自信提供实践支撑。",
      "document_id": "doc_453",
      "title": "实践意义/关联"
    },
    {
      "abstract": "香港、澳门回归二十多年发生翻天覆地变化：历经百年漂泊的两地重获新生，经济繁荣、社会安定、民生改善，呈现欣欣向荣景象。“不变”的是在“一国两制”下两地保持原有资本主义制度和生活方式长期不变，国际金融、贸易、航运中心地位和独特优势风采依旧。这种“变”与“不变”的辩证统一，雄辩证明“一国两制”是解决香港澳门问题的最佳方案、保持长期繁荣稳定的最佳制度，完全行得通、办得到、得人心，中央政府对港澳方针政策完全正确，其融入国家发展大局的初心矢志不移。",
      "document_id": "doc_641",
      "title": "香港回归的'变'与'不变'"
    },
    {
      "abstract": "澳门回归25年来经济发展与民生改善交相辉映。本地生产总值由1999年约518亿澳门元增至2023年超3700亿，人均GDP超5.5万美元居世界前列，财政储备雄厚、失业率长期低位。特区政府通过现金分享、医疗教育补贴等惠民措施把发展成果转化为民生福祉，居民平均预期寿命居全球最高之列。在经济适度多元政策下，澳门在做优博彩旅游业同时培育中医药、会展、文体等新产业，并与国家共建横琴粤澳深度合作区。这表明背靠祖国是港澳最大优势，两地优势互补、共同发展能够保持长期稳定发展良好态势，体现“一国两制”的制度效能与无限生机。",
      "document_id": "doc_1071",
      "title": "澳门经济社会发展交出精彩答卷·民生持续改善"
    },
    {
      "abstract": "香港回归以来依托“背靠祖国、联通世界”的优势，始终位居国际金融、航运、贸易中心。作为全球最重要的离岸人民币业务枢纽和最自由经济体之一，随着国安法落地和“由治及兴”，香港经济持续复苏，2024年多项指标回暖、访港旅客回升，离岸人民币存款和资产管理规模扩大，国际金融机构常态化运营，人工智能、金融科技等创科产业渐成气候。实践表明香港走上与祖国内地优势互补、共同发展的道路，自由开放、高度自治的制度优势充分彰显，继续在国家发展大局中发挥不可替代作用，是“一国两制”取得举世公认成功的有力见证。",
      "document_id": "doc_1072",
      "title": "香港巩固国际金融中心地位·经济焕发新活力"
    }
  ],
  "id": "node_1504",
  "importance": 3,
  "keywords": [
    "香港",
    "澳门",
    "繁荣稳定",
    "优势互补",
    "成果",
    "高度自治"
  ],
  "name": "香港、澳门保持长期稳定发展良好态势",
  "pictures": [],
  "revision": 3,
  "schema_version": "1.0",
  "status": "draft",
  "tags": [
    "港澳实践",
    "一国两制"
  ],
  "test": [
    {
      "description": "关于香港、澳门保持长期稳定发展良好态势的主要表现，下列说法正确的是（　）：A.香港国际金融、航运、贸易中心地位稳固，是全球最自由经济体之一并抵御了国际金融危机、新冠疫情冲击，创新科技产业迅速兴起。 B.香港、澳门回归后经济社会发展停滞不前。 C.澳门人均收入水平居世界前列但宪制秩序尚未牢固确立。 D.港澳长期稳定发展主要依赖外部力量，与\"一国两制\"无关。",
      "style": "单选题",
      "test_id": "test_1473"
    },
    {
      "description": "判断下列说法是否正确：香港、澳门的繁荣稳定主要是依靠自身地理优势实现的，与中央政府和祖国内地的支持关系不大，也不能证明\"一国两制\"制度的优越性。",
      "style": "判断题",
      "test_id": "test_1474"
    },
    {
      "description": "关于中央支持港澳的具体方向和意义，下列说法正确的是（　）：A.中央全力支持香港抓住国家发展历史机遇，对接国家战略，并支持港澳同世界开展更开放更紧密的交流合作、积极稳妥推进改革，这为港澳长期繁荣稳定提供了坚强后盾。 B.中央只支持香港发展，对澳门的发展不作支持。 C.中央支持港澳意在让其脱离国家发展大局独立运行。 D.中央支持港澳只是提供资金，与经济民生改革无关。",
      "style": "单选题",
      "test_id": "test_1475"
    },
    {
      "description": "关于加强港澳青少年教育，下列说法正确的是（　）：A.加强宪法和基本法教育、国情教育、中国历史和中华文化教育，增强港澳青少年的国家意识和爱国精神，使\"一国两制\"事业后继有人。 B.港澳青少年教育应弱化国家认同，着重与西方教育对接。 C.加强青少年教育与爱国爱港爱澳传统无关。 D.只需对部分青少年开展教育，少数青少年可不受此要求。",
      "style": "单选题",
      "test_id": "test_1476"
    }
  ],
  "updated_at": "2026-08-15T16:18:49Z"
}