{
  "abstract": "党的力量来自组织，要贯彻新时代党的组织路线，严密党的组织体系，建设堪当民族复兴重任的高素质专业化干部队伍，为实现党的历史使命提供坚强组织保证。",
  "aliases": [
    "新时代党的组织路线",
    "组织体系建设",
    "干部队伍建设"
  ],
  "assessment": {
    "learning_objectives": [
      "能够理解党的力量来自组织的深刻含义",
      "能够说明严密党的组织体系的要求",
      "能够理解建设高素质专业化干部队伍的标准和途径"
    ]
  },
  "difficulty": 3,
  "documents": [
    {
      "abstract": "党的力量来自组织。贯彻新时代党的组织路线，重点在于严密党的组织体系——中央和国家机关是贯彻党中央决策部署的「最初一公里」、地方党委是「中间段」、基层党组织是「最后一公里」，各自建强、层层贯通，增强党组织政治功能和组织功能；同时建设高素质专业化干部队伍，坚持党管干部原则和「信念坚定、为民服务、勤政务实、敢于担当、清正廉洁」的新时代好干部标准，干部要做到忠诚干净担当，并建立健全素质培养、知事识人、选拔任用、从严管理、正向激励五大工作体系，提高党员发展质量、发挥先锋模范作用。",
      "document_id": "doc_517",
      "title": "贯彻新时代党的组织路线 · 原文要义"
    },
    {
      "abstract": "党的力量来自组织，党的全面领导和全部工作要靠坚强组织体系实现。贯彻新时代党的组织路线的核心是建设堪当民族复兴重任的干部队伍、增强党组织政治功能和组织功能。它强调两个重点：一是严密党的组织体系，我国建立了包括党中央、地方和基层在内的上下贯通、执行有力的严密组织体系，这是世界任何其他政党不具有的强大优势；二是建设高素质专业化干部队伍，坚持党管干部原则和新时代好干部标准，干部要做到忠诚干净担当。在落实上中央和机关是「最初一公里」、地方党委是「中间段」、基层党组织是「最后一公里」。",
      "document_id": "doc_518",
      "title": "概念解析/理论背景"
    },
    {
      "abstract": "贯彻新时代党的组织路线的实践要求是：做好干部培育、选拔、管理、使用工作，建立健全源头培养、跟踪培养、全程培养的素质培养体系，日常考核、分类考核、近距离考核的知事识人体系，以德为先、任人唯贤、人事相宜的选拔任用体系，管思想、管工作、管作风、管纪律的从严管理体系，以及激励干部担当作为的正向激励体系；同时加强党员教育管理，发挥先锋模范作用。它与政治建设相衔接，突出政治标准选贤任能；与自我革命的「自我完善」「自我提高」相呼应，通过能力建设提升执政本领；为反腐败斗争提供「忠诚干净担当」的干部队伍支撑，是坚持党的领导的组织保障。",
      "document_id": "doc_519",
      "title": "实践意义/关联"
    },
    {
      "abstract": "从2014年到2022年，八部大型反腐电视专题片先后播出，成为正风肃纪反腐最直观的“影像册”，每部都由真实落马干部现身说法，让全面从严治党从抽象概念变得具体可感。这八部片子标记着全面从严治党每一步脚印，从党的十八大后雷霆反腐到“打虎”“拍蝇”“猎狐”持续推进再到制度笼子不断扎紧，既是记录也是“永远在路上”的注脚。触目惊心的案例警示党员干部“手莫伸，伸手必被捉”，一以贯之的是党中央推进全面从严治党、正风肃纪反腐的坚强决心，让观众看到自我革命最真实的样子。",
      "document_id": "doc_650",
      "title": "八部反腐电视专题片——全面从严治党的“影像册”"
    },
    {
      "abstract": "贯彻新时代党的组织路线重点在于建设高素质专业化干部队伍。黄文秀生前是广西百色市乐业县新化镇百坭村驻村第一书记，2016年从北师大硕士毕业后放弃大城市机会回到家乡投身扶贫，走遍全村195户贫困户，绘制民情地图，带领群众发展砂糖橘等产业，将贫困发生率从22.88%降至2.71%。2019年6月16日她冒雨返村途中遭遇山洪牺牲，年仅30岁。习近平总书记作出重要指示号召向她学习，她被追授“时代楷模”“全国优秀共产党员”等称号。黄文秀是新时代好干部的杰出代表，战斗到生命最后一刻，彰显忠诚担当、情系群众、无私奉献的优秀品质。",
      "document_id": "doc_1087",
      "title": "黄文秀——用生命诠释担当的驻村第一书记"
    },
    {
      "abstract": "基层党组织是党的全部工作和战斗力的基础，新时代组织路线强调以提升组织力为重点建设坚强战斗堡垒。党中央持续开展“两优一先”（优秀共产党员、优秀党务工作者、先进基层党组织）评选表彰。2024年“七一”前后中央和各地举行表彰，2025、2026年山西、宜宾等多省市集中表彰优秀党员干部和先进基层党组织，如宜宾锦屏镇党委强基固本、发展特色产业成为乡村振兴“领头雁”。各地还广泛设立“党员责任区”“党员示范岗”，全国490多万个基层党组织通过标准化规范化建设提升组织覆盖和活力。“两优一先”表彰树立身边榜样，激励党员比学赶超，推动基层党组织全面进步全面过硬。",
      "document_id": "doc_1088",
      "title": "“两优一先”表彰——锻造坚强有力的基层党组织"
    }
  ],
  "id": "node_1706",
  "importance": 4,
  "keywords": [
    "组织体系",
    "高素质专业化",
    "忠诚干净担当",
    "战斗堡垒",
    "选拔任用体系"
  ],
  "name": "贯彻新时代党的组织路线",
  "pictures": [],
  "revision": 3,
  "schema_version": "1.0",
  "status": "draft",
  "tags": [
    "组织建设",
    "干部工作"
  ],
  "test": [
    {
      "description": "关于新时代党的组织路线的核心要求和重点，下列说法正确的是（　）：A.核心要求是建设堪当民族复兴重任的干部队伍、增强党组织政治功能和组织功能；B.核心只在于扩大党员数量规模；C.重点抓的是精简机构、压缩编制而非组织体系与干部队伍；D.严密组织体系与干部队伍建设互不相关、可分头进行。",
      "style": "单选题",
      "test_id": "test_1578"
    },
    {
      "description": "判断下列说法是否正确：只要选好配强中央和地方的领导干部，基层党组织建设的好坏对全局无关紧要。",
      "style": "判断题",
      "test_id": "test_1579"
    },
    {
      "description": "关于贯通各环节的党的组织体系建设要求，下列说法正确的是（　）：A.中央和国家机关、地方党委、基层党组织各管各的，不必形成整体；B.中央和国家机关应建设成为讲政治、守纪律、负责任、有效率的模范机关，各层组织共同构成上下贯通、执行有力的组织体系；C.地方党委只要决策正确即可，监督和管理无须严格；D.基层党组织只是执行机器，无须发挥战斗堡垒作用。",
      "style": "单选题",
      "test_id": "test_1580"
    },
    {
      "description": "关于新时代好干部「忠诚干净担当」的内涵，下列说法正确的是（　）：A.忠诚是指忠诚于个人和团体利益；B.干净是指洁身自好、与世无争、不作为；C.忠诚即忠诚于党、同党中央保持高度一致，干净即克己奉公、清正廉洁，担当即为党分忧、为国尽责、为民奉献、敢于善于斗争；D.担当只是个别敢冲敢闯者的品质，与干部普遍要求无关。",
      "style": "单选题",
      "test_id": "test_1581"
    },
    {
      "description": "关于建立健全素质培养、知事识人、选拔任用、从严管理、正向激励「五大体系」所体现的用人导向，下列说法正确的是（　）：A.体现党管干部原则和新时代好干部标准；B.只重选拔任用、轻视培养考核，用人导向是唯学历论；C.知事识人只凭一时一事的印象；D.从严管理与正向激励相互排斥，只能取其一。",
      "style": "单选题",
      "test_id": "test_1582"
    }
  ],
  "updated_at": "2026-08-15T16:18:49Z"
}